issue_key,summary,group_key,group_domain,group_release,group_worktype,group_priority,group_has_pr,dev_has_activity,indegree,outdegree,component_id,is_root,is_leaf
MAPREDUCE-4226,ConcurrentModificationException in FileSystemCounterGroup,,,,,,,,0,0,3559,1,1
MAPREDUCE-4227,TimeWindow statistics are not updated for TaskTrackers which have been restarted.,,,,,,,,0,0,2138,1,1
MAPREDUCE-4228,mapreduce.job.reduce.slowstart.completedmaps is not working properly to delay the scheduling of the reduce tasks,,,,,,,,0,0,2543,1,1
MAPREDUCE-4229,Counter names' memory usage can be decreased by interning,,,,,,,,0,0,2889,1,1
MAPREDUCE-423,Remove getNumResolvedTaskTrackers() api from JobTracker,,,,,,,,0,0,3989,1,1
MAPREDUCE-4230,Ensure framework counter group synchronization is correct for serialization/deserialization,,,,,,,,0,0,6829,1,1
MAPREDUCE-4231,Update RAID to not to use FSInodeInfo,,,,,,,,0,0,292,1,1
MAPREDUCE-4232,Make the distributed cache tests easier to diagnose,,,,,,,,0,0,4030,1,1
MAPREDUCE-4233,NPE can happen in RMNMNodeInfo.,,,,,,,,0,0,6354,1,1
MAPREDUCE-4234,SortValidator.java is incompatible with multi-user or parallel use (due to a /tmp file with static name),,,,,,,,0,0,1616,1,1
MAPREDUCE-4235,Killing app can lead to inconsistent app status between RM and HS,,,,,,,,0,0,1437,1,1
MAPREDUCE-4236,Failing tests in branch-2,,,,,,,,0,0,3,1,1
MAPREDUCE-4237,TestNodeStatusUpdater can fail if localhost has a domain associated with it,,,,,,,,0,0,1918,1,1
MAPREDUCE-4238,mavenize data_join,,,,,,,,0,0,1050,1,1
MAPREDUCE-4239,gridmix has 11 findbugs warnings,,,,,,,,0,0,4221,1,1
MAPREDUCE-424,Unreachable code in TaskInProgress.inCompleteSubTask,,,,,,,,0,0,1018,1,1
MAPREDUCE-4240,Revert MAPREDUCE-2767 ,,,,,,,,0,0,5992,1,1
MAPREDUCE-4241,Pipes examples do not compile on Ubuntu 12.04,,,,,,,,0,0,4510,1,1
MAPREDUCE-4242,port gridmix tests to yarn,,,,,,,,0,0,590,1,1
MAPREDUCE-4243,Modify mapreduce build to include task-controller,,,,,,,,0,0,4355,1,1
MAPREDUCE-4244,Fix an issue related to do with setting of correct groups for tasks,,,,,,,,0,0,4802,1,1
MAPREDUCE-4246,Failure in deleting user directories in Secure hadoop,,,,,,,,0,0,373,1,1
MAPREDUCE-4247,TestTaskTrackerLocalization fails ,,,,,,,,0,0,504,1,1
MAPREDUCE-4248,TestRecoveryManager fails,,,,,,,,0,0,5922,1,1
MAPREDUCE-4249,Fix failures in streaming test TestFileArgs,,,,,,,,0,0,2082,1,1
MAPREDUCE-425,NPE in TaskInProgress.cleanup,,,,,,,,0,0,6575,1,1
MAPREDUCE-4250,"hadoop-config.sh missing variable exports, causes Yarn jobs to fail with ClassNotFoundException MRAppMaster",,,,,,,,0,0,4390,1,1
MAPREDUCE-4251,API Incompatibility - Sampler,,,,,,,,0,0,3366,1,1
MAPREDUCE-4252,MR2 job never completes with 1 pending task,,,,,,,,0,0,3184,1,1
MAPREDUCE-4253,Tests for mapreduce-client-core are lying under mapreduce-client-jobclient,,,,,,,,2,2,340,0,0
MAPREDUCE-4255,Job History Server throws NPE if it fails to get keytab,,,,,,,,0,0,4535,1,1
MAPREDUCE-4256,Improve resource scheduling,,,,,,,,0,0,3742,1,1
MAPREDUCE-4257,Support fair-sharing option within a MR2 Capacity Scheduler queue,,,,,,,,0,0,3705,1,1
MAPREDUCE-4258,container-executor can't open 2+ GB files when compiled for 32-bit ,,,,,,,,0,0,1844,1,1
MAPREDUCE-426,Race condition in LaunchTaskAction and KillJobAction,,,,,,,,0,0,4302,1,1
MAPREDUCE-4260,Use JobObject to spawn tasks on Windows,,,,,,,,0,0,550,1,1
MAPREDUCE-4261,MRAppMaster throws NPE while stopping RMContainerAllocator service,,,,,,,,0,0,327,1,1
MAPREDUCE-4262,"NM gives wrong log message saying ""Connected to ResourceManager"" before trying to connect",,,,,,,,0,0,2195,1,1
MAPREDUCE-4263,Use taskkill /T to terminate tasks on Windows,,,,,,,,0,0,5274,1,1
MAPREDUCE-4264,Got ClassCastException when using mapreduce.history.server.delegationtoken.required=true,,,,,,,,0,0,4712,1,1
MAPREDUCE-4265,Support Queue type exclusive or shared,,,,,,,,0,0,2424,1,1
MAPREDUCE-4266,remove Ant remnants from MR,,,,,,,,0,0,3857,1,1
MAPREDUCE-4267,mavenize pipes,,,,,,,,0,0,6117,1,1
MAPREDUCE-4269,documentation: Gridmix has javadoc warnings in StressJobFactory,,,,,,,,0,0,1846,1,1
MAPREDUCE-427,Earlier key-value buffer from MapTask.java is still referenced even though its not required anymore.,,,,,,,,0,0,4477,1,1
MAPREDUCE-4270,data_join test classes are in the wrong packge,,,,,,,,0,0,1234,1,1
MAPREDUCE-4271,Make TestCapacityScheduler more robust with non-Sun JDK,,,,,,,,0,0,3738,1,1
MAPREDUCE-4272,SortedRanges.Range#compareTo is not spec compliant,,,,,,,,0,0,3483,1,1
MAPREDUCE-4273,Make CombineFileInputFormat split result JDK independent,,,,,,,,0,0,2209,1,1
MAPREDUCE-4274,MapOutputBuffer should use native byte order for kvmeta,,,,,,,,0,0,1591,1,1
MAPREDUCE-4276,"Allow setting yarn.nodemanager.delete.debug-delay-sec property to ""-1"" for easier container debugging.",,,,,,,,0,0,1030,1,1
MAPREDUCE-4278,cannot run two local jobs in parallel from the same gateway.,,,,,,,,0,0,846,1,1
MAPREDUCE-4279,getClusterStatus() fails with null pointer exception when running jobs in local mode,,,,,,,,0,0,4117,1,1
MAPREDUCE-428,Reducers reported completion % is generally incorrect when consuming compressed map outputs,,,,,,,,0,0,4055,1,1
MAPREDUCE-4280,LocalJobRunner doesn't honor custom OutputCommiter cleanupJob,,,,,,,,0,0,5644,1,1
MAPREDUCE-4281,LocalJobRunner doesn't handle Jobs using o.a.h.mapreduce.OutputCommitter,,,,,,,,0,0,3111,1,1
MAPREDUCE-4282,Convert Forrest docs to APT,,,,,,,,0,0,4594,1,1
MAPREDUCE-4283,Display tail of aggregated logs by default,,,,,,,,0,0,3305,1,1
MAPREDUCE-4284,Allow setting yarn.nodemanager.delete.debug-delay-sec on a per-job basis,,,,,,,,0,0,1285,1,1
MAPREDUCE-4285,Code sample in Tool javadocs is broken,,,,,,,,0,0,2638,1,1
MAPREDUCE-4286,TestClientProtocolProviderImpls passes on failure conditions,,,,,,,,0,0,313,1,1
MAPREDUCE-4287,jobClient.getQueues () API is giving empty by default,,,,,,,,0,0,2789,1,1
MAPREDUCE-4288,ClusterStatus.getMapTasks() and ClusterStatus.getReduceTasks() is giving one when no job is running,,,,,,,,0,0,5928,1,1
MAPREDUCE-4289,JobStatus.getReduceProgress() and JobStatus.getMapProgress() API's not giving any values,,,,,,,,0,0,6685,1,1
MAPREDUCE-429,HADOOP-801 doesn't add property to hadoop-default.xml,,,,,,,,0,0,3819,1,1
MAPREDUCE-4290,JobStatus.getState() API is giving ambiguous values,,,,,,,,0,0,2481,1,1
MAPREDUCE-4291,RpcServerFactoryPBImpl force yarn users to define a protocol in a entailed namespace,,,,,,,,0,0,4816,1,1
MAPREDUCE-4292,Job is hanging forever when some maps are failing always,,,,,,,,0,0,794,1,1
MAPREDUCE-4293,Rumen TraceBuilder gets NPE some times,,,,,,,,0,0,5228,1,1
MAPREDUCE-4294,Submitting job by enabling task profiling gives IOException,,,,,,,,0,0,2356,1,1
MAPREDUCE-4295,RM crashes due to DNS issue,,,,,,,,0,0,4417,1,1
MAPREDUCE-4297,Usersmap file in gridmix should not fail on empty lines,,,,,,,,0,0,6264,1,1
MAPREDUCE-4298,NodeManager crashed after running out of file descriptors,,,,,,,,0,0,1173,1,1
MAPREDUCE-4299,Terasort hangs with MR2 FifoScheduler,,,,,,,,0,0,6036,1,1
MAPREDUCE-43,Retired jobs are not present in the job list returned to the job-client.,,,,,,,,0,0,701,1,1
MAPREDUCE-430,Task stuck in cleanup with OutOfMemoryErrors,,,,,,,,0,0,6335,1,1
MAPREDUCE-4300,OOM in AM can turn it into a zombie.,,,,,,,,0,0,6834,1,1
MAPREDUCE-4301,Dedupe some strings in MRAM for memory savings,,,,,,,,0,0,6748,1,1
MAPREDUCE-4302,NM goes down if error encountered during log aggregation,,,,,,,,0,0,1045,1,1
MAPREDUCE-4303,Look at using String.intern to dedupe some Strings,,,,,,,,0,0,1164,1,1
MAPREDUCE-4304,Deadlock where all containers are held by ApplicationMasters should be prevented,,,,,,,,0,0,5098,1,1
MAPREDUCE-4305,Implement delay scheduling in capacity scheduler for improving data locality,,,,,,,,0,0,3529,1,1
MAPREDUCE-4306,Problem running Distributed Shell applications as a user other than the one started the daemons,,,,,,,,0,0,613,1,1
MAPREDUCE-4307,TeraInputFormat calls FileSystem.getDefaultBlockSize() without a Path - Failure when using ViewFileSystem,,,,,,,,0,0,808,1,1
MAPREDUCE-4308,Remove excessive split log messages,,,,,,,,0,0,1328,1,1
MAPREDUCE-431,Task left in RUNNING state even after the job completion,,,,,,,,0,0,5267,1,1
MAPREDUCE-4311,Capacity scheduler.xml does not accept decimal values for capacity and maximum-capacity settings,,,,,,,,0,0,6258,1,1
MAPREDUCE-4312,Add metrics to RM for NM heartbeats,,,,,,,,0,0,129,1,1
MAPREDUCE-4313,TestTokenCache doesn't compile due TokenCache.getDelegationToken compilation error,,,,,,,,0,0,4622,1,1
MAPREDUCE-4314,Synchronization in JvmManager for 0.22 branch,,,,,,,,0,0,3139,1,1
MAPREDUCE-4315,jobhistory.jsp throws 500 when a .txt file is found in /done,,,,,,,,0,0,5226,1,1
MAPREDUCE-4317,Job view ACL checks are too permissive,,,,,,,,0,0,3875,1,1
MAPREDUCE-4318,TestRecoveryManager should not use raw and deprecated configuration parameters.,,,,,,,,0,0,141,1,1
MAPREDUCE-4319,MRClientProtocolPBClientImpl creates proxy for AM ignoring custom SocketFactory,,,,,,,,0,0,5083,1,1
MAPREDUCE-432,JobClient should check input/output specifications  before copying the job files on the DFS,,,,,,,,0,0,5422,1,1
MAPREDUCE-4320,gridmix mainClass wrong in pom.xml,,,,,,,,0,0,6159,1,1
MAPREDUCE-4321,DefaultTaskController fails to launch tasks on Windows,,,,,,,,0,0,1070,1,1
MAPREDUCE-4322,Fix command-line length abort issues on Windows,,,,,,,,0,0,2042,1,1
MAPREDUCE-4324,JobClient can perhaps set mapreduce.job.credentials.binary rather than expect its presence?,,,,,,,,0,0,1554,1,1
MAPREDUCE-4328,Add the option to quiesce the JobTracker,,,,,,,,0,0,6245,1,1
MAPREDUCE-4329,security.task.umbilical.protocol.acl should not be configurable,,,,,,,,0,0,5851,1,1
MAPREDUCE-433,TestReduceFetch failed.,,,,,,,,0,0,4864,1,1
MAPREDUCE-4330,TaskAttemptCompletedEventTransition invalidates previously successful attempt without checking if the newly completed attempt is successful,,,,,,,,0,0,89,1,1
MAPREDUCE-4331,TaskAttemptListenerImpl.statusUpdate and TaskAttemptListenerImpl.ping never return false,,,,,,,,0,0,2903,1,1
MAPREDUCE-4333,ZipKin support,,,,,,,,0,0,6093,1,1
MAPREDUCE-4336,Distributed Shell fails when used with the CapacityScheduler,,,,,,,,0,0,5471,1,1
MAPREDUCE-4337,Support multiple reducers in 'uber' jobs,,,,,,,,0,0,409,1,1
MAPREDUCE-4338,NodeManager daemon is failing to start.,,,,,,,,0,0,6631,1,1
MAPREDUCE-4339,pi example job hangs on when run on hadoop 0.23.0 when capacity scheduler is included in the setting environment.,,,,,,,,0,0,2937,1,1
MAPREDUCE-434,LocalJobRunner limited to single reducer,,,,,,,,0,0,3684,1,1
MAPREDUCE-4340,Node Manager leaks socket connections connected to Data Node,,,,,,,,0,0,4063,1,1
MAPREDUCE-4341,add types to capacity scheduler properties documentation,,,,,,,,0,0,6193,1,1
MAPREDUCE-4342,Distributed Cache gives inconsistent result if cache files get deleted from task tracker ,,,,,,,,0,0,2743,1,1
MAPREDUCE-4343,ZK recovery support for ResourceManager,,,,,,,,0,0,343,1,1
MAPREDUCE-4344,ZKClient does not support auth,,,,,,,,0,0,4661,1,1
MAPREDUCE-4346,Adding a refined version of JobTracker.getAllJobs() and exposing through the JobClient,,,,,,,,0,0,5714,1,1
MAPREDUCE-4347,joined PhD. Intrested to do research in cloud especially in Hadoop. need suggession for problems to work.,,,,,,,,0,0,4438,1,1
MAPREDUCE-4348,"JobSubmissionProtocol should be made public, not package private",,,,,,,,0,0,156,1,1
MAPREDUCE-4349,Distributed Cache gives inconsistent result if cache Archive files get deleted from task tracker ,,,,,,,,0,0,4696,1,1
MAPREDUCE-435,JobTracker might not accept first few jobs if restarted immediately,,,,,,,,0,0,2589,1,1
MAPREDUCE-4350,Distributed Cache should put files read only on Task tracker,,,,,,,,0,0,3384,1,1
MAPREDUCE-4353,fix TestPipes,,,,,,,,0,0,1734,1,1
MAPREDUCE-4354,Performance improvement with compressor object reinit restriction,,,,,,,,0,0,1098,1,1
MAPREDUCE-4355,Add RunningJob.getJobStatus(),,,,,,,,0,0,15,1,1
MAPREDUCE-4356,Provide access to ParsedTask.obtainTaskAttempts(),,,,,,,,0,0,3673,1,1
MAPREDUCE-4357,"Snappy Codec does not load properly when m/r job is run in ""uber"" mode",,,,,,,,0,0,4343,1,1
MAPREDUCE-4358,Reducers are assigned containers before all maps are assigned containers,,,,,,,,0,0,6826,1,1
MAPREDUCE-4359,Potential deadlock in Counters,,,,,,,,0,0,2423,1,1
MAPREDUCE-436,NPE in TaskRunner.run if hadoop.log.dir not set,,,,,,,,0,0,4573,1,1
MAPREDUCE-4360,Capacity Scheduler Hierarchical leaf queue does not honor the max capacity of container queue,,,,,,,,0,0,6464,1,1
MAPREDUCE-4361,Fix detailed metrics for protobuf-based RPC on 0.23,,,,,,,,0,0,2365,1,1
MAPREDUCE-4362,"If possible, we should get back the feature of propagating task logs back to JobClient",,,,,,,,0,0,1988,1,1
MAPREDUCE-4363,"Hadoop 1.X, 2.X and trunk do not build on Fedora 17",,,,,,,,0,0,5269,1,1
MAPREDUCE-4365,Shipping Profiler Libraries by DistributedCache,,,,,,,,0,0,4659,1,1
MAPREDUCE-4366,mapred metrics shows negative count of waiting maps and reduces,,,,,,,,0,0,5108,1,1
MAPREDUCE-4367,mapred job -kill tries to connect to history server,,,,,,,,0,0,6556,1,1
MAPREDUCE-4368,TaskRunner fails to start jars when the java.library.path contains a quoted path with embedded spaces,,,,,,,,0,0,6774,1,1
MAPREDUCE-4369,Fix streaming job failures with WindowsResourceCalculatorPlugin,,,,,,,,0,0,2091,1,1
MAPREDUCE-437,JobTracker must ask for a new FS instance and close it when terminated.,,,,,,,,0,0,5582,1,1
MAPREDUCE-4370,eclipse plugin for 1.0.3 hadoop version - impossible to generate it,,,,,,,,0,0,3549,1,1
MAPREDUCE-4371,Check for cyclic dependencies in Jobcontrol job DAG,,,,,,,,0,0,4444,1,1
MAPREDUCE-4372,Deadlock in Resource Manager between SchedulerEventDispatcher.EventProcessor and Shutdown hook manager,,,,,,,,0,0,3220,1,1
MAPREDUCE-4373,Fix Javadoc warnings in JobClient.,,,,,,,,0,0,2083,1,1
MAPREDUCE-4374,Fix child task environment variable config and add support for Windows,,,,,,,,0,0,2500,1,1
MAPREDUCE-4375,Show Configuration Tracability in MR UI,,,,,,,,0,0,5983,1,1
MAPREDUCE-4376,TestClusterMRNotification times out,,,,,,,,0,0,3603,1,1
MAPREDUCE-4377,TaskRunner javaopts parsing doesn't handle embedded spaces,,,,,,,,0,0,1549,1,1
MAPREDUCE-4378,hadoop-validate-setup.sh fails to execute kinit command in secure mode,,,,,,,,0,0,2609,1,1
MAPREDUCE-4379,Node Manager throws java.lang.OutOfMemoryError: Java heap space due to org.apache.hadoop.fs.LocalDirAllocator.contexts,,,,,,,,0,0,879,1,1
MAPREDUCE-438,When connecting to HDFS using an IP  Task MapRed gets confused when checking the output path. ,,,,,,,,0,0,2821,1,1
MAPREDUCE-4380,Empty Userlogs directory is getting created under logs directory,,,,,,,,0,0,4358,1,1
MAPREDUCE-4381,Make PROGRESS_INTERVAL of org.apache.hadoop.mapred.Task a tunable,,,,,,,,0,0,2272,1,1
MAPREDUCE-4382,RMContainerImpl State Machine Doesn't Handle RELEASED State from AM Properly,,,,,,,,0,0,4168,1,1
MAPREDUCE-4383,HadoopPipes.cc needs to include unistd.h,,,,,,,,0,0,3020,1,1
MAPREDUCE-4384,Race conditions in IndexCache,,,,,,,,0,0,833,1,1
MAPREDUCE-4385,FairScheduler.maxTasksToAssign() should check for fairscheduler.assignmultiple.maps < TaskTracker.availableSlots,,,,,,,,0,0,6632,1,1
MAPREDUCE-4386,"Investigate possible abstractions for shell commands ""bash -c"" and ""cmd /c""",,,,,,,,0,0,1927,1,1
MAPREDUCE-4387,RM gets fatal error and exits during TestRM,,,,,,,,0,0,29,1,1
MAPREDUCE-4388,Cleanup of restart count in job tracker as it is no longer needed,,,,,,,,0,0,6065,1,1
MAPREDUCE-4389,Map only jobs should work even for MapOutput(Key|Value)Class configuration,,,,,,,,0,0,4680,1,1
MAPREDUCE-4390,java.io.IOException: File /user/XXXX/QuasiMonteCarlo_TMP_3_141592654/in/part0 could only be replicated to 0 nodes instead of minReplication (=1).  There are 0 datanode(s) running and no node(s) are excluded in this operation.,,,,,,,,0,0,2450,1,1
MAPREDUCE-4391,datanode.DataNode (DataNode.java:handshake(820)) - Problem connecting to server: master/192.168.100.140:9000,,,,,,,,0,0,528,1,1
MAPREDUCE-4392,Counters.makeCompactString() changed behavior from 0.20,,,,,,,,0,0,2273,1,1
MAPREDUCE-4394,ReduceTask.MapOutputCopier.copyOutput() signature doesn't match the corresponding Javadoc,,,,,,,,0,0,3597,1,1
MAPREDUCE-4395,Possible NPE at ClientDistributedCacheManager#determineTimestamps,,,,,,,,0,0,4863,1,1
MAPREDUCE-4396,Make LocalJobRunner work with private distributed cache,,,,,,,,0,0,3583,1,1
MAPREDUCE-4397,Introduce HADOOP_SECURITY_CONF_DIR for task-controller,,,,,,,,0,0,5706,1,1
MAPREDUCE-4398,Fix mapred.system.dir permission error with FairScheduler,,,,,,,,0,0,4668,1,1
MAPREDUCE-4399,Fix performance regression in shuffle ,,,,,,,,0,0,3961,1,1
MAPREDUCE-44,"Hang JobTracker, running out of memory",,,,,,,,0,0,664,1,1
MAPREDUCE-440,-archives option in JobConf doesn't support symlink for an uncompressed archive directory,,,,,,,,0,0,1064,1,1
MAPREDUCE-4400,Fix performance regression for small jobs/workflows,,,,,,,,0,0,5366,1,1
MAPREDUCE-4401,Enhancements to MapReduce for Windows Server and Windows Azure development and runtime environments,,,,,,,,0,0,1457,1,1
MAPREDUCE-4402,TestFileInputFormat fails intermittently,,,,,,,,0,0,453,1,1
MAPREDUCE-4403,Adding test case for resubmission of jobs in TestRecoveryManager,,,,,,,,0,0,4423,1,1
MAPREDUCE-4404,Adding Test case for TestMRJobClient to verify the user name,,,,,,,,0,0,3488,1,1
MAPREDUCE-4405,Adding test case for HierarchicalQueue in TestJobQueueClient,,,,,,,,0,0,38,1,1
MAPREDUCE-4406,Users should be able to specify the MiniCluster ResourceManager and JobHistoryServer ports,,,,,,,,0,2,321,1,0
MAPREDUCE-4407,Add hadoop-yarn-server-tests-<version>-tests.jar to hadoop dist package,,,,,,,,0,2,321,1,0
MAPREDUCE-4408,allow jobs to set a JAR that is in the distributed cached,,,,,,,,0,0,6145,1,1
MAPREDUCE-441,TestMapReduceJobControl.testJobControlWithKillJob timedout in of the hudson runs,,,,,,,,0,0,1867,1,1
MAPREDUCE-4412,No mapred-site.xml present in the configuration directory. This is very trivial but thought would be less confusing for a new user if it came packaged.,,,,,,,,0,0,5522,1,1
MAPREDUCE-4413,MR lib dir contains jdiff (which is gpl),,,,,,,,0,0,5900,1,1
MAPREDUCE-4414,"Add main methods to JobConf and YarnConfiguration, for debug purposes",,,,,,,,0,0,3340,1,1
MAPREDUCE-4415,Backport the Job.getInstance methods from MAPREDUCE-1505 to branch-1,,,,,,,,0,0,1791,1,1
MAPREDUCE-4416,Some tests fail if Clover is enabled,,,,,,,,0,0,2597,1,1
MAPREDUCE-4417,add support for encrypted shuffle,,,,,,,,0,0,646,1,1
MAPREDUCE-4418,Gridmix should emulate hdfs_bytes_read when compression emulation is ON,,,,,,,,0,0,4487,1,1
MAPREDUCE-4419,./mapred queue -info <queuename> -showJobs displays all the jobs irrespective of <queuename> ,,,,,,,,0,0,3481,1,1
MAPREDUCE-442,Ability to re-configure hadoop daemons online,,,,,,,,0,0,2868,1,1
MAPREDUCE-4420,./mapred queue -info <queuename> -showJobs displays containers and memory as zero always,,,,,,,,0,0,4752,1,1
MAPREDUCE-4421,Run MapReduce framework via the distributed cache,,,,,,,,0,0,4173,1,1
MAPREDUCE-4422,YARN_APPLICATION_CLASSPATH needs a documented default value in YarnConfiguration,,,,,,,,0,0,3781,1,1
MAPREDUCE-4423,Potential infinite fetching of map output,,,,,,,,0,0,242,1,1
MAPREDUCE-4424,'mapred job -list' command should show the job name as well,,,,,,,,0,0,1849,1,1
MAPREDUCE-4425,Speculation + Fetch failures can lead to a hung job,,,,,,,,0,0,6711,1,1
MAPREDUCE-4426,Hook daemon process exit for testing,,,,,,,,0,0,4158,1,1
MAPREDUCE-4428,A failed job is not available under job history if the job is killed right around the time job is notified as failed ,,,,,,,,0,0,6719,1,1
MAPREDUCE-4429,Upgrade Guava for critical performance bug fix,,,,,,,,0,0,2673,1,1
MAPREDUCE-443,snapshot a map-reduce to DFS ... and restore,,,,,,,,0,0,481,1,1
MAPREDUCE-4430,"Adding child queues to any queue need the process restart ""./yarn rmadmin -refreshQueues"" throws IO exception",,,,,,,,0,0,2418,1,1
MAPREDUCE-4431,mapred command should print the reason on killing already completed jobs,,,,,,,,0,0,6644,1,1
MAPREDUCE-4432,Confusing warning message when GenericOptionsParser is not used,,,,,,,,0,0,2056,1,1
MAPREDUCE-4433,Use Time#now and Time#monotonicNow instead of System#currentTimeMillis,,,,,,,,0,0,1890,1,1
MAPREDUCE-4434,Backport MR-2779 (JobSplitWriter.java can't handle large job.split file) to branch-1,,,,,,,,0,0,6011,1,1
MAPREDUCE-4435,Expose JobTracker metrics for number of reducers in shuffle vs. sort vs. reduce phase,,,,,,,,0,0,2487,1,1
MAPREDUCE-4437,Race in MR ApplicationMaster can cause reducers to never be scheduled,,,,,,,,0,0,1242,1,1
MAPREDUCE-4439,MAPREDUCE-3451 introduced a bunch of findbugs warnings,,,,,,,,2,0,6265,0,1
MAPREDUCE-444,Job should be able to specify whether task vm is 32 or 64 bit,,,,,,,,0,0,2468,1,1
MAPREDUCE-4440,Change SchedulerApp & SchedulerNode to be a minimal interface ,,,,,,,,0,0,5930,1,1
MAPREDUCE-4441,Fix build issue caused by MR-3451,,,,,,,,0,2,6265,1,0
MAPREDUCE-4442,Accessing hadoop counters from a job is unreliable in yarn during AM process cleanup  window,,,,,,,,0,0,1223,1,1
MAPREDUCE-4443,MR AM and job history server should be resilient to jobs that exceed counter limits ,,,,,,,,0,0,1961,1,1
MAPREDUCE-4444,nodemanager fails to start when one of the local-dirs is bad,,,,,,,,0,0,5494,1,1
MAPREDUCE-4445,TestFSSchedulerApp should be in scheduler.fair package,,,,,,,,0,0,5843,1,1
MAPREDUCE-4447,Remove aop from cruft from the ant build ,,,,,,,,0,0,1500,1,1
MAPREDUCE-4448,Nodemanager crashes upon application cleanup if aggregation failed to start,,,,,,,,0,0,1606,1,1
MAPREDUCE-4449,Incorrect MR_HISTORY_STORAGE property name in JHAdminConfig,,,,,,,,0,0,4076,1,1
MAPREDUCE-445,Web service interface to the JobTracker,,,,,,,,0,0,854,1,1
MAPREDUCE-4450,Hadoop jar names don't match the GridMix(2) scripts.,,,,,,,,0,0,266,1,1
MAPREDUCE-4451,fairscheduler fail to init job with kerberos authentication configured,,,,,,,,0,0,3341,1,1
MAPREDUCE-4453,Jobs should be executed as same user in hadoop-validate-setup.sh,,,,,,,,0,0,5662,1,1
MAPREDUCE-4454,MR does not audit-log the job kill operations,,,,,,,,0,0,2588,1,1
MAPREDUCE-4456,LocalDistributedCacheManager can get an ArrayIndexOutOfBounds when creating symlinks,,,,,,,,0,0,5657,1,1
MAPREDUCE-4457,mr job invalid transition TA_TOO_MANY_FETCH_FAILURE at FAILED,,,,,,,,0,0,5734,1,1
MAPREDUCE-4458,Warn if java.library.path is used for AM or Task,,,,,,,,0,0,3367,1,1
MAPREDUCE-4459,Allow ad-placement on the JobTracker /RM UI,,,,,,,,0,0,4254,1,1
MAPREDUCE-446,The WebUI pages that display the list of map and reduce tasks should also include the hostname where the task is running,,,,,,,,0,0,5788,1,1
MAPREDUCE-4461,Resourcemanager UI does not show the queue details in IE,,,,,,,,0,0,895,1,1
MAPREDUCE-4462,Enhance readability of TestFairScheduler.java,,,,,,,,0,0,4264,1,1
MAPREDUCE-4463,JobTracker recovery fails with HDFS permission issue,,,,,,,,0,0,3748,1,1
MAPREDUCE-4464,Reduce tasks failing with NullPointerException in ConcurrentHashMap.get(),,,,,,,,0,0,4339,1,1
MAPREDUCE-4465,Update description of yarn.nodemanager.address property,,,,,,,,0,0,564,1,1
MAPREDUCE-4467,IndexCache failures due to missing synchronization,,,,,,,,0,0,6811,1,1
MAPREDUCE-4468,Encapsulate FairScheduler preemption logic into helper class,,,,,,,,0,0,2985,1,1
MAPREDUCE-447,Add Serialization for RecordIO,,,,,,,,0,0,6066,1,1
MAPREDUCE-4470,Fix TestCombineFileInputFormat.testForEmptyFile,,,,,,,,2,2,13,0,0
MAPREDUCE-4471,TestClientRMService.testGetQueueInfo failing after MR-4427,,,,,,,,0,0,518,1,1
MAPREDUCE-4473,tasktracker rank on machines.jsp?type=active,,,,,,,,0,0,4901,1,1
MAPREDUCE-4474,TestDistributedShell.testDSShell fails on CentOS 6 because of high virtual memory usage,,,,,,,,0,0,3547,1,1
MAPREDUCE-4475,testForEmptyFile failed,,,,,,,,0,0,3963,1,1
MAPREDUCE-4477,Improve task finish synchronization,,,,,,,,0,0,2851,1,1
MAPREDUCE-4478,TaskTracker's heartbeat is out of control,,,,,,,,0,0,5640,1,1
MAPREDUCE-4479,Fix parameter order in assertEquals() in TestCombineInputFileFormat.java,,,,,,,,2,0,13,0,1
MAPREDUCE-448,Facility to connect back to a job from the command line. ,,,,,,,,0,0,5789,1,1
MAPREDUCE-4480,T_ATTEMPT_KILLED after SUCCEEDED can happen for reduces too ,,,,,,,,0,0,5225,1,1
MAPREDUCE-4481,User Log Retention across TT restarts,,,,,,,,0,0,5849,1,1
MAPREDUCE-4482,Backport MR sort plugin(MAPREDUCE-2454) to Hadoop 1.2,,,,,,,,0,0,1798,1,1
MAPREDUCE-4483,2.0 build does not work ,,,,,,,,0,0,5762,1,1
MAPREDUCE-4484,Incorrect IS_MINI_YARN_CLUSTER property name in YarnConfiguration,,,,,,,,0,0,4294,1,1
MAPREDUCE-4486,issues in POM of hadoop-yarn-applications-unmanaged-am-launcher,,,,,,,,0,0,904,1,1
MAPREDUCE-4487,Reduce job latency by removing hardcoded sleep statements,,,,,,,,0,0,4298,1,1
MAPREDUCE-4488,Port MAPREDUCE-463 (The job setup and cleanup tasks should be optional) to branch-1,,,,,,,,0,0,6790,1,1
MAPREDUCE-449,There is little information provided when the TaskTracker kills a Task that has not reported within the timeout (600 sec) interval - this patch provides a stack trace of the task ,,,,,,,,0,0,4278,1,1
MAPREDUCE-4490,JVM reuse is incompatible with LinuxTaskController (and therefore incompatible with Security),,,,,,,,0,0,1481,1,1
MAPREDUCE-4491,Encryption and Key Protection,,,,,,,,0,0,4175,1,1
MAPREDUCE-4492,Configuring total queue capacity between 100.5 and 99.5 at perticular level is sucessfull,,,,,,,,0,0,1033,1,1
MAPREDUCE-4493,Distibuted Cache Compatability Issues,,,,,,,,0,0,2294,1,1
MAPREDUCE-4494,"TestFifoScheduler failing with Metrics source QueueMetrics,q0=default already exists!",,,,,,,,0,0,615,1,1
MAPREDUCE-4496,AM logs link is missing user name,,,,,,,,0,0,6388,1,1
MAPREDUCE-4497,"JobTracker webUI ""Kill Selected Jobs"" button has no effect",,,,,,,,0,0,3215,1,1
MAPREDUCE-4498,Remove hsqldb jar from Hadoop runtime classpath,,,,,,,,0,0,2358,1,1
MAPREDUCE-4499,Looking for speculative tasks is very expensive in 1.x,,,,,,,,0,0,2232,1,1
MAPREDUCE-45,JobStatus should contain user name and carry forward start time when job is killed.,,,,,,,,0,0,4586,1,1
