issue_key,summary,group_key,group_domain,group_release,group_worktype,group_priority,group_has_pr,dev_has_activity,indegree,outdegree,component_id,is_root,is_leaf
MAPREDUCE-1,Hadoop  mapreduce should always ship the jar file(s) specified by the user,,,,,,,,0,0,1238,1,1
MAPREDUCE-10,NPE in SocketChannelOutputStream during large sort benchmark,,,,,,,,0,0,929,1,1
MAPREDUCE-100,Sporadic TestEmptyJobWithDFS failure due to NPE is JobTracker.submitJob(),,,,,,,,0,0,162,1,1
MAPREDUCE-1000,JobHistory.initDone() should retain the try ... catch in the body,,,,,,,,0,0,369,1,1
MAPREDUCE-1001,Reducing code duplication in Mumak,,,,,,,,0,0,650,1,1
MAPREDUCE-1002,"After MAPREDUCE-862, command line queue-list doesn't print any queues",,,,,,,,0,0,2634,1,1
MAPREDUCE-1003,trunk build fails when -Declipse.home is set,,,,,,,,0,0,4149,1,1
MAPREDUCE-1004,ant binary does not  copy the jar files properly,,,,,,,,0,0,5712,1,1
MAPREDUCE-1005,why should not capacity sheduler jar not copied under lib during build,,,,,,,,0,0,2535,1,1
MAPREDUCE-1006,Making JobStoryProducer and ClusterStory pluggable in Mumak,,,,,,,,0,0,1255,1,1
MAPREDUCE-1007,MAPREDUCE-777 breaks the UI for hierarchial Queues. ,,,,,,,,0,2,3507,1,0
MAPREDUCE-1008,distcp needs CLI unit tests,,,,,,,,0,0,1251,1,1
MAPREDUCE-1009,Forrest documentation needs to be updated to describes features provided for supporting hierarchical queues,,,,,,,,0,0,3986,1,1
MAPREDUCE-101,Deserialize interface to support mechanism for supporting progress method in RecordReader,,,,,,,,0,0,6512,1,1
MAPREDUCE-1010,Adding tests for changes in archives.,,,,,,,,0,0,3203,1,1
MAPREDUCE-1011,Git and Subversion ignore of build.properties,,,,,,,,0,0,2315,1,1
MAPREDUCE-1012,Context interfaces should be Public Evolving,,,,,,,,0,0,455,1,1
MAPREDUCE-1013, MapReduce Project page does not show 0.20.1 documentation/release information.,,,,,,,,0,0,6308,1,1
MAPREDUCE-1014,"After the 0.21 branch, MapReduce trunk doesn't compile",,,,,,,,0,0,4061,1,1
MAPREDUCE-1015,Map-Reduce interface classification,,,,,,,,0,0,2300,1,1
MAPREDUCE-1016,Make the format of the Job History be JSON instead of Avro binary,,,,,,,,0,4,767,1,0
MAPREDUCE-1017,Compression and output splitting for Sqoop,,,,,,,,0,0,4501,1,1
MAPREDUCE-1018,Document changes to the memory management and scheduling model,,,,,,,,0,0,1313,1,1
MAPREDUCE-1019,Stale user directories left on TTs after MAPREDUCE-856,,,,,,,,0,0,610,1,1
MAPREDUCE-102,NPE in tracker expiry thread.,,,,,,,,0,0,5795,1,1
MAPREDUCE-1020,Add more unit tests to test the queue refresh feature MAPREDUCE-893,,,,,,,,0,0,2364,1,1
MAPREDUCE-1021,mapred-default.xml does not document all framework config parameters,,,,,,,,0,0,285,1,1
MAPREDUCE-1022,Trunk tests fail because of test-failure in Vertica,,,,,,,,0,0,1634,1,1
MAPREDUCE-1023,Newly introduced findBugs warnings should be suppressed,,,,,,,,0,0,4543,1,1
MAPREDUCE-1024,Provide proper test cases to test the CLI of hierarchical queues,,,,,,,,0,0,4571,1,1
MAPREDUCE-1025,Subprocesses of tasks should be killed even if mapred.userlog.limit.kb is set to a positive value when setsid is used for launching tasks,,,,,,,,2,0,1712,0,1
MAPREDUCE-1026,Shuffle should be secure,,,,,,,,0,0,2674,1,1
MAPREDUCE-1027,jobtracker.jsp can have an html text block for announcements by admins.,,,,,,,,0,0,534,1,1
MAPREDUCE-1028,"Cleanup tasks are scheduled using high memory configuration, leaving tasks in unassigned state.",,,,,,,,0,0,2807,1,1
MAPREDUCE-1029,TestCopyFiles fails on testHftpAccessControl(),,,,,,,,0,0,6723,1,1
MAPREDUCE-103,The TaskTracker's shell environment should not be passed to the children.,,,,,,,,0,0,5097,1,1
MAPREDUCE-1030,Reduce tasks are getting starved in capacity scheduler,,,,,,,,0,0,5664,1,1
MAPREDUCE-1031,ant tar target doens't seem to compile tests in contrib projects,,,,,,,,0,0,1959,1,1
MAPREDUCE-1032,taskcontroller.cfg should be checked before task tracker comes up,,,,,,,,0,0,1836,1,1
MAPREDUCE-1033,Resolve location of scripts and configuration files after project split,,,,,,,,0,0,2181,1,1
MAPREDUCE-1034,Update forrest documentation about cluster restartability w.r.t mapreduce JobTracker,,,,,,,,0,0,1508,1,1
MAPREDUCE-1035,Remove streaming forrest documentation from the common project,,,,,,,,0,0,4206,1,1
MAPREDUCE-1036,An API Specification for Sqoop,,,,,,,,0,0,11,1,1
MAPREDUCE-1037,Failing contrib unit tests should not halt the build,,,,,,,,0,0,6221,1,1
MAPREDUCE-1038,Mumak's compile-aspects target weaves aspects even though there are no changes to the Mumak's sources,,,,,,,,0,0,5451,1,1
MAPREDUCE-1039,cluster_setup.xml exists in both mapreduce and common projects,,,,,,,,0,0,494,1,1
MAPREDUCE-104,Not able to refresh file cache,,,,,,,,0,0,1982,1,1
MAPREDUCE-1040,"acls are not set to ""*"" when acls is enabled and acls are not defined",,,,,,,,0,0,634,1,1
MAPREDUCE-1041,TaskStatuses map in TaskInProgress should be made package private instead of protected,,,,,,,,0,0,247,1,1
MAPREDUCE-1042,rumen should be able to output compressed trace files,,,,,,,,0,0,563,1,1
MAPREDUCE-1043,JobHistory.parseHistoryFromFS does not appear to get us the information in conf files that correspond to jobs.,,,,,,,,0,0,2491,1,1
MAPREDUCE-1044,Ability to automatically move machines from one MR compute cluster to another,,,,,,,,2,0,3970,0,1
MAPREDUCE-1045,Changes to deprecated interfaces break Hive,,,,,,,,0,0,4089,1,1
MAPREDUCE-1046,Remove mapred.{map|reduce}.child.ulimit and use mapred.job.{map|reduce}.memory.mb as the task's ulimit value,,,,,,,,0,0,5260,1,1
MAPREDUCE-1047,hadoop.pipes.command.port missing from environment when using bash 4,,,,,,,,0,0,1562,1,1
MAPREDUCE-1048,Show total slot usage in cluster summary on jobtracker webui,,,,,,,,0,0,2894,1,1
MAPREDUCE-1049,Cause for failures due to errors in job-initialization are not communicated back to the client,,,,,,,,0,0,1501,1,1
MAPREDUCE-105,Handling of mapred.task.profile.params is hprof specific,,,,,,,,0,0,5661,1,1
MAPREDUCE-1050,Introduce a mock object testing framework,,,,,,,,0,0,4840,1,1
MAPREDUCE-1051,mapred.local.dir gets a hardcoded Path in MiniMRCluster.,,,,,,,,0,0,5090,1,1
MAPREDUCE-1052,"In 0.20, JobHistory parsed files using callbacks [Listener].  In 0.21, JobHistoryParser creates a monolithic JobInfo object.",,,,,,,,0,0,5907,1,1
MAPREDUCE-1053,MRReliabilityTest does not kill/fail tasks if history is enabled,,,,,,,,0,0,2920,1,1
MAPREDUCE-1054,[Mumak] Enhance unit test coverage,,,,,,,,0,0,805,1,1
MAPREDUCE-1055,Improve SimulatorTaskTracker test cases to test tasks that require multiple slots,,,,,,,,0,0,6648,1,1
MAPREDUCE-1056,[Mumak] Add forrest documentation for mumak,,,,,,,,0,0,5918,1,1
MAPREDUCE-1057,java tasks are not honouring the value of mapred.userlog.limit.kb,,,,,,,,0,2,1712,1,0
MAPREDUCE-1058,analysehistory.jsp should report node where task ran,,,,,,,,0,0,3279,1,1
MAPREDUCE-1059,distcp can generate uneven map task assignments,,,,,,,,0,0,3667,1,1
MAPREDUCE-106,The temporary disk space limits should not skip jobs,,,,,,,,0,0,6256,1,1
MAPREDUCE-1060,JT should kill running maps when all the reducers have completed,,,,,,,,0,0,2847,1,1
MAPREDUCE-1061,Gridmix unit test should validate input/output bytes,,,,,,,,0,0,405,1,1
MAPREDUCE-1062,MRReliability test does not work with retired jobs,,,,,,,,0,0,5320,1,1
MAPREDUCE-1063,Document Gridmix benchmark,,,,,,,,0,0,6571,1,1
MAPREDUCE-1064,Add unit tests to test Job and Cluster ,,,,,,,,0,0,1179,1,1
MAPREDUCE-1065,Modify the mapred tutorial documentation to use new mapreduce api.,,,,,,,,0,0,2972,1,1
MAPREDUCE-1066,Add a unit test  to test all the apis in mapreduce.lib.join ,,,,,,,,0,0,3472,1,1
MAPREDUCE-1067,Default state of queues is undefined when unspecified,,,,,,,,0,0,841,1,1
MAPREDUCE-1068,In hadoop-0.20.0 streaming job do not throw proper verbose error message if file is not present,,,,,,,,0,0,947,1,1
MAPREDUCE-1069,Implement Sqoop API refactoring,,,,,,,,0,0,5204,1,1
MAPREDUCE-107,Tasks fail due to lost mapout,,,,,,,,0,0,1219,1,1
MAPREDUCE-1070,Deadlock in FairSchedulerServlet,,,,,,,,0,0,5601,1,1
MAPREDUCE-1071,o.a.h.mapreduce.jobhistory.EventReader constructor should expect DataInputStream,,,,,,,,0,0,1412,1,1
MAPREDUCE-1072,o.a.h.mapreduce.jobhistory.EventWriter.VERSION should be public.,,,,,,,,2,0,767,0,1
MAPREDUCE-1073,Progress reported for pipes tasks is incorrect.,,,,,,,,0,0,2328,1,1
MAPREDUCE-1074,Provide documentation for Mark/Reset functionality,,,,,,,,0,0,2569,1,1
MAPREDUCE-1075,getQueue(String queue) in JobTracker would return NPE for invalid queue name,,,,,,,,2,2,3507,0,0
MAPREDUCE-1076,ClusterStatus class should be deprecated ,,,,,,,,0,0,5089,1,1
MAPREDUCE-1077,"When rumen reads a truncated job tracker log, it produces a job whose outcome is SUCCESS.  Should be null.",,,,,,,,0,0,3898,1,1
MAPREDUCE-1078,Unit test for zero map jobs and killed jobs,,,,,,,,0,0,3594,1,1
MAPREDUCE-1079,"Split commands_manual.xml into common, mapreduce and hdfs parts",,,,,,,,0,0,6853,1,1
MAPREDUCE-108,Blacklisted hosts may not be able to serve map outputs,,,,,,,,0,0,697,1,1
MAPREDUCE-1080,Properties max.map.slots and max.reduce.slots should be hyphenated.,,,,,,,,0,0,1146,1,1
MAPREDUCE-1081,Move hadoop_archives.xml out of mapreduce project,,,,,,,,0,0,4431,1,1
MAPREDUCE-1082,Command line UI for queues' information is broken with hierarchical queues.,,,,,,,,2,2,3507,0,0
MAPREDUCE-1083, Use the user-to-groups mapping service in the JobTracker,,,,,,,,0,0,302,1,1
MAPREDUCE-1084,Implementing aspects development and fault injeciton framework for MapReduce,,,,,,,,0,0,6551,1,1
MAPREDUCE-1085,"For tasks, ""ulimit -v -1"" is being run when user doesn't specify mapred.child.ulimit",,,,,,,,0,0,4971,1,1
MAPREDUCE-1086,hadoop commands in streaming tasks are trying to write to tasktracker's log,,,,,,,,0,0,1233,1,1
MAPREDUCE-1087,Limit resource usage of Map/Reduce debug script,,,,,,,,0,0,6705,1,1
MAPREDUCE-1088,JobHistory files should have narrower 0600 perms ,,,,,,,,0,0,1607,1,1
MAPREDUCE-1089,Fair Scheduler preemption triggers NPE when tasks are scheduled but not running,,,,,,,,0,0,3258,1,1
MAPREDUCE-1090,Modify log statement in Tasktracker log related to memory monitoring to include attempt id.,,,,,,,,0,0,4998,1,1
MAPREDUCE-1091,TaskTrackers only work with same build as the JobTracker,,,,,,,,0,0,2432,1,1
MAPREDUCE-1092,Enable asserts for tests by default,,,,,,,,2,0,3977,0,1
MAPREDUCE-1093,Java assertion failures triggered by tests,,,,,,,,0,2,3977,1,0
MAPREDUCE-1094,CapacityScheduler's JobInitPoller shouldn't 'sleep',,,,,,,,0,0,4759,1,1
MAPREDUCE-1095,Hadoop 0.20 Compatible IdentityMapper and IdentityReducer,,,,,,,,0,0,2427,1,1
MAPREDUCE-1096,Add getNames method to VerticaRecord to retrieve input column names,,,,,,,,0,0,4467,1,1
MAPREDUCE-1097,Changes/fixes to support Vertica 3.5,,,,,,,,0,0,473,1,1
MAPREDUCE-1098,Incorrect synchronization in DistributedCache causes TaskTrackers to freeze up during localization of Cache for tasks.,,,,,,,,0,0,3799,1,1
MAPREDUCE-1099,Setup and cleanup tasks could affect job latency if they are caught running on bad nodes,,,,,,,,0,0,2175,1,1
MAPREDUCE-11,Cleanup JobHistory file naming to do with job recovery,,,,,,,,0,0,6612,1,1
MAPREDUCE-110,Unit tests for LinuxTaskController binary,,,,,,,,0,0,6553,1,1
MAPREDUCE-1100,User's task-logs filling up local disks on the TaskTrackers,,,,,,,,0,0,1435,1,1
MAPREDUCE-1101,Rename core jar to common jar,,,,,,,,0,0,5023,1,1
MAPREDUCE-1102,Job gets killed even when the cleanup completes,,,,,,,,0,0,4362,1,1
MAPREDUCE-1103,Additional JobTracker metrics,,,,,,,,0,0,2994,1,1
MAPREDUCE-1104,RecoveryManager not initialized in SimulatorJobTracker led to NPE in JT Jetty server,,,,,,,,0,2,1380,1,0
MAPREDUCE-1105,CapacityScheduler: It should be possible to set queue hard-limit beyond it's actual capacity,,,,,,,,0,0,2060,1,1
MAPREDUCE-1106,LocalJobRunner should run with any file-system,,,,,,,,0,0,5190,1,1
MAPREDUCE-1107,Creating a new fairscheduler,,,,,,,,0,0,2201,1,1
MAPREDUCE-1108,Modify test-patch.sh to verify that the number of findBugs warning is always zero,,,,,,,,0,0,2218,1,1
MAPREDUCE-1109,ConcurrentModificationException in jobtracker.jsp,,,,,,,,0,0,5541,1,1
MAPREDUCE-111,JobTracker.getSystemDir throws NPE if it is called during intialization,,,,,,,,0,0,6295,1,1
MAPREDUCE-1110,"Currently QueueManager API's return JobQueueInfo , instead it should return QueueInfo, similarly wher ever  we are using JobQueueInfo as view , we should use QueueInfo",,,,,,,,4,0,3507,0,1
MAPREDUCE-1111,JT Jetty UI not working if we run mumak.sh off packaged distribution directory.,,,,,,,,2,0,1380,0,1
MAPREDUCE-1112,Fix CombineFileInputFormat for hadoop 0.20,,,,,,,,0,0,2289,1,1
MAPREDUCE-1113,mumak compiles aspects even if skip.contrib is true,,,,,,,,0,0,2722,1,1
MAPREDUCE-1114,Speed up ivy resolution in builds with clever caching,,,,,,,,0,0,1188,1,1
MAPREDUCE-1115,Support hierarchical pools of directories to use for intermediate MapReduce data files (for SSD drives),,,,,,,,0,0,2323,1,1
MAPREDUCE-1116,Task continues to get localized even though it is marked for killing already,,,,,,,,0,0,2177,1,1
MAPREDUCE-1117,ClusterMetrics return metrics for tasks instead of slots',,,,,,,,0,0,2935,1,1
MAPREDUCE-1118,Capacity Scheduler scheduling information is hard to read / should be tabular format,,,,,,,,0,0,6746,1,1
MAPREDUCE-1119,"When tasks fail to report status, show tasks's stack dump before killing",,,,,,,,0,0,1137,1,1
MAPREDUCE-112,Reduce Input Records and Reduce Output Records counters are not being set when using the new Mapreduce reducer API,,,,,,,,0,0,6102,1,1
MAPREDUCE-1120,"JobClient poll intervals should be job configurations, not cluster configurations",,,,,,,,0,0,1114,1,1
MAPREDUCE-1121,Hadoop MapReduce - Site Logo,,,,,,,,0,0,5779,1,1
MAPREDUCE-1122,streaming with custom input format does not support the new API,,,,,,,,2,0,278,0,1
MAPREDUCE-1124,TestGridmixSubmission fails sometimes,,,,,,,,0,0,3682,1,1
MAPREDUCE-1125,SerialUtils.cc: deserializeFloat is out of sync with SerialUtils.hh,,,,,,,,0,0,3876,1,1
MAPREDUCE-1126,shuffle should use serialization to get comparator,,,,,,,,0,2,3090,1,0
MAPREDUCE-1127,distcp should timeout later during S3-based transfers,,,,,,,,0,0,1655,1,1
MAPREDUCE-1128,MRUnit Allows Iteration Twice,,,,,,,,0,0,3708,1,1
MAPREDUCE-1129,Assign multiple Map and Reduce tasks in Fairscheduler,,,,,,,,0,0,4413,1,1
MAPREDUCE-113,[mapred] Job submission to an invalid queue should fail.,,,,,,,,0,0,420,1,1
MAPREDUCE-1130,Provide a way to open and read a side file using an existing InputFormat,,,,,,,,0,0,4801,1,1
MAPREDUCE-1131,Using profilers other than hprof can cause JobClient to report job failure,,,,,,,,0,0,4480,1,1
MAPREDUCE-1132,TestGridmixSubmission failing intermittently,,,,,,,,0,0,1262,1,1
MAPREDUCE-1133,Eclipse .classpath template has outdated jar files and is missing some new ones.,,,,,,,,0,0,3939,1,1
MAPREDUCE-1134,The API around HistoryEvent has inelegances,,,,,,,,0,0,5964,1,1
MAPREDUCE-1135,Making JobHistory log format easily extensible in the future,,,,,,,,2,0,767,0,1
MAPREDUCE-1136,ConcurrentModificationException when tasktracker updates task status to jobtracker,,,,,,,,0,0,4463,1,1
MAPREDUCE-1137,Mumak should have a unit test to ensure jetty UI is running properly,,,,,,,,0,0,6232,1,1
MAPREDUCE-1138,Erroneous output folder handling in streaming testcases,,,,,,,,0,0,6629,1,1
MAPREDUCE-1139,Contrib tests should respect scr/test/mapred-site.xml,,,,,,,,0,0,4441,1,1
MAPREDUCE-114,"All reducer tasks are finished, while some mapper tasks are still running",,,,,,,,0,0,1362,1,1
MAPREDUCE-1140,Per cache-file refcount can become negative when tasks release distributed-cache files,,,,,,,,0,0,5863,1,1
MAPREDUCE-1141,Localization of a task's distributed-cache files gets blocked by deletion of old unrelated files when mapreduce.tasktracker.cache.local.size is hit.,,,,,,,,0,0,5429,1,1
MAPREDUCE-1142,"When cache.local.size is hit on one disk, DistributedCacheManager aggressively deletes old files on other disks too.",,,,,,,,0,0,6062,1,1
MAPREDUCE-1143,runningMapTasks counter is not properly decremented in case of failed Tasks.,,,,,,,,0,0,6246,1,1
MAPREDUCE-1144,JT should not hold lock while writing user history logs to DFS,,,,,,,,0,0,1715,1,1
MAPREDUCE-1145,Multiple Outputs doesn't work with new API in 0.20 branch,,,,,,,,0,0,4199,1,1
MAPREDUCE-1146,Sqoop dependencies break Ecpilse build on Linux,,,,,,,,0,0,2240,1,1
MAPREDUCE-1147,Map output records counter missing for map-only jobs in new API,,,,,,,,0,0,3348,1,1
MAPREDUCE-1148,SQL identifiers are a superset of Java identifiers,,,,,,,,0,0,6176,1,1
MAPREDUCE-1149,SQL identifiers are a superset of Java identifiers,,,,,,,,0,0,6415,1,1
MAPREDUCE-115,Map tasks are receiving FileNotFound Exceptions for spill files on a regular basis and are getting killed,,,,,,,,0,0,199,1,1
MAPREDUCE-1150,"In the enumeral Events.EventType , a TaskAttemptFinishedEvent returns a MAP_ATTEMPT_FINISHED .",,,,,,,,0,0,1190,1,1
MAPREDUCE-1151,Cleanup and Setup jobs should only call cleanupJob() and setupJob() methods of the OutputCommitter,,,,,,,,0,0,3760,1,1
MAPREDUCE-1152,JobTrackerInstrumentation.killed{Map/Reduce} is never called,,,,,,,,0,0,5033,1,1
MAPREDUCE-1153,Metrics counting tasktrackers and blacklisted tasktrackers are not updated when trackers are decommissioned.,,,,,,,,0,0,2505,1,1
MAPREDUCE-1154,"Large-scale, automated test framwork for Map-Reduce",,,,,,,,0,0,2823,1,1
MAPREDUCE-1155,Streaming tests swallow exceptions,,,,,,,,0,0,5608,1,1
MAPREDUCE-1156,Caching localized counter names in mapred.Counters,,,,,,,,0,0,5808,1,1
MAPREDUCE-1157,JT UI shows incorrect scheduling info for failed/killed retired jobs,,,,,,,,0,0,5157,1,1
MAPREDUCE-1158,running_maps is not decremented when the tasks of a job is killed/failed ,,,,,,,,0,0,5414,1,1
MAPREDUCE-1159,Limit Job name on jobtracker.jsp to be 80 char long,,,,,,,,0,0,6128,1,1
MAPREDUCE-116,Have a test to verify that descendent processes of tasks that ignore SIGTERM are eventually cleaned up by a SIGKILL,,,,,,,,0,0,6448,1,1
MAPREDUCE-1160,Two log statements at INFO level fill up jobtracker logs,,,,,,,,0,0,836,1,1
MAPREDUCE-1161,NotificationTestCase should not lock current thread,,,,,,,,0,0,2287,1,1
MAPREDUCE-1162,Job history should keep track of which task trackers were blacklisted,,,,,,,,0,0,186,1,1
MAPREDUCE-1163,hdfsJniHelper.h: Yahoo! specific paths are encoded,,,,,,,,0,0,5963,1,1
MAPREDUCE-1165,SerialUtils.hh: __PRETTY_FUNCTION__ is a GNU extension and not portable,,,,,,,,0,0,4220,1,1
MAPREDUCE-1166,SerialUtils.cc: dynamic allocation of arrays based on runtime variable is not portable,,,,,,,,0,0,283,1,1
MAPREDUCE-1167,Make ProcfsBasedProcessTree collect rss memory information,,,,,,,,0,2,3454,1,0
MAPREDUCE-1168,Export data to databases via Sqoop,,,,,,,,0,0,652,1,1
MAPREDUCE-1169,Improvements to mysqldump use in Sqoop,,,,,,,,0,0,586,1,1
MAPREDUCE-117,ReduceCopier sleeps for a hardcoded interval of 5secs,,,,,,,,0,0,6687,1,1
MAPREDUCE-1170,MultipleInputs doesn't work with new API in 0.20 branch,,,,,,,,0,0,2867,1,1
MAPREDUCE-1171,Lots of fetch failures,,,,,,,,0,0,3412,1,1
MAPREDUCE-1172,TestReduceFetch failed in 0.20,,,,,,,,0,0,2983,1,1
MAPREDUCE-1173,Documenting MapReduce metrics,,,,,,,,0,0,3295,1,1
MAPREDUCE-1174,Sqoop improperly handles table/column names which are reserved sql words,,,,,,,,0,0,5617,1,1
MAPREDUCE-1175,We should have a spec on JobHistory file format,,,,,,,,0,0,248,1,1
MAPREDUCE-1176,FixedLengthInputFormat and FixedLengthRecordReader,,,,,,,,0,0,399,1,1
MAPREDUCE-1177,TestTaskTrackerMemoryManager retries a task for more than 100 times.,,,,,,,,0,0,1389,1,1
MAPREDUCE-1178,MultipleInputs fails with ClassCastException ,,,,,,,,0,0,6327,1,1
MAPREDUCE-1179,org.apache.hadoop.streaming.TestSymLink.testSymLink is failing ,,,,,,,,0,0,4420,1,1
MAPREDUCE-118,Job.getJobID() will always return null,,,,,,,,0,0,233,1,1
MAPREDUCE-1180,Detailed area chart of map/reduce slots usage,,,,,,,,0,0,5037,1,1
MAPREDUCE-1181,Enforce RSS memory limit in TaskMemoryManagerThread,,,,,,,,0,0,336,1,1
MAPREDUCE-1182,Reducers fail with OutOfMemoryError while copying Map outputs,,,,,,,,0,0,971,1,1
MAPREDUCE-1183,"Serializable job components: Mapper, Reducer, InputFormat, OutputFormat et al",,,,,,,,0,0,6814,1,1
MAPREDUCE-1184,mapred.reduce.slowstart.completed.maps is too low by default,,,,,,,,0,0,6242,1,1
MAPREDUCE-1185,URL to JT webconsole for running job and job history should be the same,,,,,,,,0,0,1381,1,1
MAPREDUCE-1186,"While localizing a DistributedCache file, TT sets permissions recursively on the whole base-dir",,,,,,,,2,0,3920,0,1
MAPREDUCE-1187,mradmin -refreshNodes should be implemented,,,,,,,,0,0,4641,1,1
MAPREDUCE-1188,NPE in decommissioning blacklisted nodes,,,,,,,,0,0,889,1,1
MAPREDUCE-1189,Reduce ivy console output to ovservable level,,,,,,,,0,0,1243,1,1
MAPREDUCE-119,JobTracker and TaskTracker enter infinite loop when TaskTracker reports bad taskid,,,,,,,,0,0,6519,1,1
MAPREDUCE-1190,Add package.html to pi and pi.math packages.,,,,,,,,0,0,1971,1,1
MAPREDUCE-1191,JobInProgress.createCache() should not add unknown hosts to the host-to-rack location mapping.,,,,,,,,0,0,3146,1,1
MAPREDUCE-1192,Use the DistributedCache for job.xml and job.jar,,,,,,,,0,0,5405,1,1
MAPREDUCE-1193,Progress reporting in map-only jobs should not have phases,,,,,,,,0,0,5381,1,1
MAPREDUCE-1194,mapred.reduce.slowstart.completed.maps allows values more than 1.0 and less than 0.0,,,,,,,,0,0,2949,1,1
MAPREDUCE-1195,Task resource utilization reporting for profiling and scheduling,,,,,,,,0,0,4270,1,1
MAPREDUCE-1196,MAPREDUCE-947 incompatibly changed FileOutputCommitter,,,,,,,,0,0,5412,1,1
MAPREDUCE-1197,username:jobid  in job history search should be separated into two.,,,,,,,,0,0,318,1,1
MAPREDUCE-1198,Alternatively schedule different types of tasks in fair share scheduler,,,,,,,,0,0,4422,1,1
MAPREDUCE-1199,TaskInProgress should also consider blacklisted node while (re)scheduling failed tasks,,,,,,,,0,0,3527,1,1
MAPREDUCE-12,Tasks execed by the task controller shouldn't inherit tasktracker groups,,,,,,,,0,0,1308,1,1
MAPREDUCE-120,Reducer sort failed due to wrong key class,,,,,,,,0,0,653,1,1
MAPREDUCE-1200,TestGridmixSubmission unit Test is failing in trunk,,,,,,,,0,0,4554,1,1
MAPREDUCE-1201,Make ProcfsBasedProcessTree collect CPU usage information,,,,,,,,2,0,3454,0,1
MAPREDUCE-1202,Checksum error on a single reducer does not trigger too many fetch failures for mapper during shuffle,,,,,,,,0,0,6779,1,1
MAPREDUCE-1203,DBOutputFormat: add batch size support for JDBC and recieve  DBWritable object in value not in key,,,,,,,,0,0,4354,1,1
MAPREDUCE-1204,Fair Scheduler preemption may preempt tasks running in slots unusable by the preempting job,,,,,,,,0,0,894,1,1
MAPREDUCE-1205,Need method to parse comma separated path strings that contain hadoop file glob pattern ,,,,,,,,0,0,3274,1,1
MAPREDUCE-1206,"Need a better answer for ""how many reduces?""",,,,,,,,0,0,219,1,1
MAPREDUCE-1207,Allow admins to set java options for map/reduce tasks,,,,,,,,0,0,2439,1,1
MAPREDUCE-1208,TestKillSubProcesses fails with NPE,,,,,,,,0,0,1802,1,1
MAPREDUCE-1209,Move common specific part of the test TestReflectionUtils out of mapred into common,,,,,,,,0,0,3992,1,1
MAPREDUCE-121,DistributedCache parses Paths with sheme or port components incorrectly,,,,,,,,0,0,4970,1,1
MAPREDUCE-1210,standalone \r is treated as new line by RecordLineReader,,,,,,,,0,0,3055,1,1
MAPREDUCE-1211,Online aggregation and continuous query support,,,,,,,,0,0,372,1,1
MAPREDUCE-1212,Mapreduce contrib project ivy dependencies are not included in binary target,,,,,,,,0,0,5831,1,1
MAPREDUCE-1213,TaskTrackers restart is very slow because it deletes distributed cache directory synchronously,,,,,,,,0,4,3571,1,0
MAPREDUCE-1214,Add support for counters in Hadoop Local Mode,,,,,,,,0,0,3718,1,1
MAPREDUCE-1215,Counter deprecation warnings in jobtracker log are excessive,,,,,,,,0,0,1749,1,1
MAPREDUCE-1216,MRUnit Should Sort Reduce Input,,,,,,,,0,0,4269,1,1
MAPREDUCE-1217,TestMapReduceLocal fails intermittently. Assert message is unclear  ,,,,,,,,0,0,1543,1,1
MAPREDUCE-1218,Collecting cpu and memory usage for TaskTrackers,,,,,,,,0,0,1027,1,1
MAPREDUCE-1219,JobTracker Metrics causes undue load on JobTracker,,,,,,,,0,0,956,1,1
MAPREDUCE-122,JobTracker.addNewTracker() unnecessarily resolves already resolved nodes,,,,,,,,0,0,1520,1,1
MAPREDUCE-1220,Implement an in-cluster LocalJobRunner,,,,,,,,0,0,6537,1,1
MAPREDUCE-1221,Kill tasks on a node if the free physical memory on that machine falls below a configured threshold,,,,,,,,0,0,2380,1,1
MAPREDUCE-1222,[Mumak] We should not include nodes with numeric ips in cluster topology.,,,,,,,,0,0,6628,1,1
MAPREDUCE-1223,CompositeInputFormat doesn't consider all tuples when run in a local task tracker,,,,,,,,0,0,3695,1,1
MAPREDUCE-1224,"Calling ""SELECT t.* from <table> AS t"" to get meta information is too expensive for big tables",,,,,,,,0,0,2026,1,1
MAPREDUCE-1225,TT successfully localizes a task even though the corresponding cache-file has already changed on DFS.,,,,,,,,0,0,2933,1,1
MAPREDUCE-1226,Granularity Variable Task Pre-Scheduler in Heterogeneous Environment ,,,,,,,,0,0,5350,1,1
MAPREDUCE-1227,Allow JobTracker to pause task scheduling,,,,,,,,2,0,797,0,1
MAPREDUCE-1228,OutOfMemoryErrors in ReducerTask due to int overflow on >2G RAM tasks,,,,,,,,0,0,4999,1,1
MAPREDUCE-1229,[Mumak] Allow customization of job submission policy,,,,,,,,0,0,5262,1,1
MAPREDUCE-123,HistoryViewer usage string is misleading.,,,,,,,,0,0,2263,1,1
MAPREDUCE-1230,Vertica streaming adapter doesn't handle nulls in all cases,,,,,,,,0,0,5572,1,1
MAPREDUCE-1231,Distcp is very slow,,,,,,,,0,0,4361,1,1
MAPREDUCE-1232,Job info for root level queue does not print correct values,,,,,,,,0,0,3512,1,1
MAPREDUCE-1233,Incorrect Waiting maps/reduces in Jobtracker metrics ,,,,,,,,0,0,4127,1,1
MAPREDUCE-1234,getJobID() returns null on org.apache.hadoop.mapreduce.Job after job was submitted,,,,,,,,0,0,5479,1,1
MAPREDUCE-1235,java.io.IOException: Cannot convert value '0000-00-00 00:00:00' from column 6 to TIMESTAMP. ,,,,,,,,0,0,6260,1,1
