task_id,project_key,component_signature,main_issuetype,main_priority,issue_count,issue_keys,jira_ids,representative_summary,first_created,last_updated,Task_Tag,indegree,outdegree,is_root,is_leaf,duration_hours,topo_level,topo_order
3197,MAPREDUCE,,Bug,Major,1,MAPREDUCE-5671,12682957,NaN can be created by client and assign to Progress,2013-12-05T17:39:50,2014-09-03T20:33:53,Bug fixing / Maintenance,0,0,1,1,2.2,1,2140.0
3198,MAPREDUCE,,Improvement,Major,1,MAPREDUCE-5672,12683018,Provide optional RollingFileAppender for container log4j (syslog),2013-12-05T23:16:25,2014-07-16T22:05:09,Feature / Improvement Implementation,0,0,1,1,2.2,1,2141.0
3199,MAPREDUCE,,Bug,Major,1,MAPREDUCE-5674,12683242,Missing start and finish time in mapred.JobStatus,2013-12-07T01:48:09,2016-05-12T18:23:36,Bug fixing / Maintenance,0,0,1,1,2.2,1,2142.0
3200,MAPREDUCE,,Bug,Major,1,MAPREDUCE-5675,12683790,krb5.conf is missing in some of the test resource folders,2013-12-10T07:47:55,2013-12-10T07:49:26,Testing & Verification,0,0,1,1,2.2,1,2143.0
3201,MAPREDUCE,,Bug,Major,1,MAPREDUCE-5676,12683791,Unable to view MRv1 jobs in the MRv2 job history server after upgrading Apache Hadoop 1.2.0 to Apache Hadoop 2.1.0-beta,2013-12-10T07:54:56,2013-12-10T07:55:56,Bug fixing / Maintenance,0,0,1,1,2.2,1,2144.0
3202,MAPREDUCE,,Bug,Major,1,MAPREDUCE-5677,12683915,Hadoop 2.2 historyviewer report NPE when read 0.23 fail job's history,2013-12-10T20:52:21,2014-01-08T23:44:44,Bug fixing / Maintenance,0,0,1,1,2.2,1,2145.0
3203,MAPREDUCE,,Bug,Major,1,MAPREDUCE-5679,12684153,TestJobHistoryParsing has race condition,2013-12-12T03:12:57,2014-09-03T23:35:27,Testing & Verification,0,0,1,1,2.2,1,2146.0
3204,MAPREDUCE,,Improvement,Major,1,MAPREDUCE-5680,12684296,Reconsider limits,2013-12-12T16:32:54,2014-01-24T18:08:19,Feature / Improvement Implementation,0,0,1,1,2.2,1,2147.0
3205,MAPREDUCE,,Bug,Major,1,MAPREDUCE-5682,12684591,Job Counters are not retrieved properly from web UI,2013-12-14T01:22:16,2013-12-14T01:25:11,Bug fixing / Maintenance,0,0,1,1,2.2,1,2148.0
3207,MAPREDUCE,,Test,Major,1,MAPREDUCE-5687,12685190,TestYARNRunner#testResourceMgrDelegate fails with NPE after YARN-1446,2013-12-17T15:29:08,2014-02-24T20:58:05,Testing & Verification,0,0,1,1,2.2,1,2149.0
3209,MAPREDUCE,,Improvement,Major,1,MAPREDUCE-5691,12685539,Throttle shuffle's bandwidth utilization,2013-12-19T07:16:01,2013-12-30T02:31:45,Feature / Improvement Implementation,0,0,1,1,2.2,1,2150.0
3210,MAPREDUCE,,Improvement,Major,1,MAPREDUCE-5692,12685571,Add explicit diagnostics when a task attempt is killed due to speculative execution,2013-12-19T12:16:01,2016-06-20T21:40:19,Build & Release Engineering,0,0,1,1,2.2,1,2151.0
3211,MAPREDUCE,,Bug,Major,1,MAPREDUCE-5693,12685681,Restore MRv1 behavior for log flush,2013-12-19T21:04:15,2014-02-24T20:57:12,Bug fixing / Maintenance,0,0,1,1,2.2,1,2152.0
3214,MAPREDUCE,,Bug,Major,1,MAPREDUCE-5699,12686490,Allow setting tags on MR jobs,2013-12-27T01:09:39,2014-11-03T18:33:25,Bug fixing / Maintenance,0,0,1,1,2.2,1,2153.0
3216,MAPREDUCE,,Bug,Major,1,MAPREDUCE-5706,12687257,toBeDeleted parent directories aren't being cleaned up,2014-01-03T22:32:31,2014-05-12T22:41:50,Bug fixing / Maintenance,0,0,1,1,2.2,1,2154.0
3217,MAPREDUCE,,Bug,Major,1,MAPREDUCE-5707,12687295,JobClient does not allow setting RPC timeout for communications with JT/RM,2014-01-04T01:54:27,2014-01-09T00:53:24,Bug fixing / Maintenance,0,0,1,1,2.2,1,2155.0
3218,MAPREDUCE,,Bug,Major,1,MAPREDUCE-5709,12687393,Getting ClassNotFoundException even though jar is included in lib folder,2014-01-06T05:02:41,2014-01-15T09:13:27,Bug fixing / Maintenance,0,0,1,1,2.2,1,2156.0
3219,MAPREDUCE,,Bug,Major,1,MAPREDUCE-5711,12687631,"When JobTracker writing JobHistory to HDFS, it may hung for long time due to DataNode error",2014-01-07T13:17:00,2014-01-10T01:44:54,Bug fixing / Maintenance,0,0,1,1,2.2,1,2157.0
3221,MAPREDUCE,,Bug,Major,1,MAPREDUCE-5714,12687955,TestMRAppComponentDependencies causes surefire to exit without saying proper goodbye,2014-01-08T22:24:44,2015-03-10T04:30:14,Testing & Verification,0,0,1,1,2.2,1,2158.0
3222,MAPREDUCE,,Bug,Major,1,MAPREDUCE-5717,12688274,Task pings are interpreted as task progress,2014-01-10T16:42:10,2016-05-12T18:23:52,Bug fixing / Maintenance,0,0,1,1,2.2,1,2159.0
3223,MAPREDUCE,,Bug,Major,1,MAPREDUCE-5720,12688482,RM occur exception while unregistering,2014-01-13T01:40:32,2014-01-14T09:41:19,Bug fixing / Maintenance,0,0,1,1,2.2,1,2160.0
3227,MAPREDUCE,,Improvement,Major,1,MAPREDUCE-5732,12690162,Report proper queue when job has been automatically placed,2014-01-22T01:27:19,2014-04-10T13:11:10,Feature / Improvement Implementation,0,0,1,1,2.2,1,2161.0
323,MAPREDUCE,,Bug,Major,1,MAPREDUCE-1032,12436483,taskcontroller.cfg should be checked before task tracker comes up,2009-09-24T04:50:11,2009-09-24T04:55:02,Bug fixing / Maintenance,0,0,1,1,2.2,1,2162.0
3234,MAPREDUCE,,Bug,Major,1,MAPREDUCE-5746,12693994,Job diagnostics can implicate wrong task for a failed job,2014-02-07T20:48:37,2014-04-10T13:11:05,Bug fixing / Maintenance,0,0,1,1,2.2,1,2163.0
3235,MAPREDUCE,,Bug,Major,1,MAPREDUCE-5749,12694205,TestRMContainerAllocator#testReportedAppProgress Failed,2014-02-10T05:31:19,2015-03-10T04:30:22,Testing & Verification,0,0,1,1,2.2,1,2164.0
3236,MAPREDUCE,,Improvement,Major,1,MAPREDUCE-5750,12694348,Need ability to create ACL for viewing the listing of a job queue,2014-02-10T20:34:57,2014-03-12T14:34:06,Feature / Improvement Implementation,0,0,1,1,2.2,1,2165.0
3237,MAPREDUCE,,Bug,Major,1,MAPREDUCE-5751,12694351,MR app master fails to start in some cases if mapreduce.job.classloader is true,2014-02-10T21:03:11,2014-07-02T05:12:28,Bug fixing / Maintenance,0,0,1,1,2.2,1,2166.0
3238,MAPREDUCE,,Improvement,Major,1,MAPREDUCE-5754,12694668,Preserve Job diagnostics in history,2014-02-12T04:46:26,2014-04-10T13:11:48,Feature / Improvement Implementation,0,0,1,1,2.2,1,2167.0
3239,MAPREDUCE,,Bug,Major,1,MAPREDUCE-5756,12694823,CombineFileInputFormat.getSplits() including directories in its results,2014-02-12T19:55:22,2014-12-16T03:02:33,Bug fixing / Maintenance,0,0,1,1,2.2,1,2168.0
3240,MAPREDUCE,,Bug,Major,1,MAPREDUCE-5758,12695093,Reducer local data is not deleted until job completes,2014-02-13T22:36:23,2014-05-20T19:19:00,Bug fixing / Maintenance,0,0,1,1,2.2,1,2169.0
3241,MAPREDUCE,,Bug,Major,1,MAPREDUCE-5759,12695738,Remove unnecessary conf load in Limits,2014-02-18T17:44:43,2014-08-15T05:47:53,Bug fixing / Maintenance,0,0,1,1,2.2,1,2170.0
3243,MAPREDUCE,,Bug,Major,1,MAPREDUCE-5770,12696326,Redirection from AM-URL is broken with HTTPS_ONLY policy,2014-02-20T19:05:10,2014-04-10T13:12:11,Bug fixing / Maintenance,0,0,1,1,2.2,1,2171.0
3244,MAPREDUCE,,Bug,Major,1,MAPREDUCE-5764,12696902,Potential NullPointerException in YARNRunner.killJob(JobID arg0),2014-02-24T11:53:56,2015-03-06T04:42:23,Bug fixing / Maintenance,0,0,1,1,2.2,1,2172.0
3248,MAPREDUCE,,Bug,Major,1,MAPREDUCE-5769,12697626,Unregistration to RM should not be called if AM is crashed before registering with RM,2014-02-27T08:01:02,2014-04-10T13:12:07,Bug fixing / Maintenance,0,0,1,1,2.2,1,2173.0
3249,MAPREDUCE,,Bug,Major,1,MAPREDUCE-5771,12697782,Measure bw of a single copy call and display the correct aggregated bw,2014-02-27T19:47:44,2014-02-27T19:48:40,Bug fixing / Maintenance,0,0,1,1,2.2,1,2174.0
325,MAPREDUCE,,Task,Major,1,MAPREDUCE-1036,12436528,An API Specification for Sqoop,2009-09-24T18:18:03,2013-05-02T02:29:26,Build & Release Engineering,0,0,1,1,2.2,1,2175.0
3254,MAPREDUCE,,Bug,Major,1,MAPREDUCE-5778,12698718,JobSummary does not escape newlines in the job name,2014-03-04T20:28:31,2014-04-10T13:11:33,Bug fixing / Maintenance,0,0,1,1,2.2,1,2176.0
3255,MAPREDUCE,,Bug,Major,1,MAPREDUCE-5779,12698833,Hadoop1.0.2 : JobControl.run() Never stop,2014-03-05T09:19:31,2014-03-05T17:11:45,Bug fixing / Maintenance,0,0,1,1,2.2,1,2177.0
3257,MAPREDUCE,,Bug,Major,1,MAPREDUCE-5781,12699323,DFSCIOTest fails with libhdfs.so.1 missing,2014-03-07T02:12:14,2014-03-07T22:04:44,Testing & Verification,0,0,1,1,2.2,1,2178.0
3258,MAPREDUCE,,Task,Major,1,MAPREDUCE-5783,12699583,web UI update to allow people to request thread dump of a running task.,2014-03-08T07:20:51,2014-04-03T08:37:59,Project / General Task,0,0,1,1,2.2,1,2179.0
3260,MAPREDUCE,,Sub-task,Major,1,MAPREDUCE-5788,12699663,Modify Fetcher to pull data using persistent connection,2014-03-09T00:21:06,2014-03-20T19:20:09,Other,0,0,1,1,2.2,1,2180.0
3262,MAPREDUCE,,Bug,Major,1,MAPREDUCE-5792,12700620,"When mapreduce.jobhistory.intermediate-done-dir isn't writable, application fails with generic error",2014-03-11T01:31:21,2014-03-17T19:05:18,Bug fixing / Maintenance,0,0,1,1,2.2,1,2181.0
3263,MAPREDUCE,,Bug,Major,1,MAPREDUCE-5791,12700700,Shuffle phase is slow in Windows - FadviseFileRegion::transferTo does not read disks efficiently,2014-03-11T14:07:03,2017-08-02T21:33:10,Bug fixing / Maintenance,0,0,1,1,2.2,1,2182.0
3265,MAPREDUCE,,Bug,Major,1,MAPREDUCE-5795,12701310,Job should be marked as Failed if it is recovered from commit.,2014-03-13T18:43:42,2014-04-10T13:12:01,Bug fixing / Maintenance,0,0,1,1,2.2,1,2183.0
3266,MAPREDUCE,,Bug,Major,1,MAPREDUCE-5805,12702324,Unable to parse launch time from job history file,2014-03-19T06:04:14,2014-05-28T03:56:40,Bug fixing / Maintenance,0,0,1,1,2.2,1,2184.0
3267,MAPREDUCE,,Test,Major,1,MAPREDUCE-5804,12702397,TestMRJobsWithProfiler#testProfiler timesout,2014-03-19T15:25:34,2015-06-30T07:18:58,Testing & Verification,0,0,1,1,2.2,1,2185.0
3269,MAPREDUCE,,Bug,Major,1,MAPREDUCE-5810,12703323,TestStreamingTaskLog#testStreamingTaskLogWithHadoopCmd is failing,2014-03-24T21:22:13,2016-05-12T18:22:50,Testing & Verification,0,0,1,1,2.2,1,2186.0
327,MAPREDUCE,,Bug,Major,1,MAPREDUCE-1038,12436560,Mumak's compile-aspects target weaves aspects even though there are no changes to the Mumak's sources,2009-09-25T05:08:12,2010-08-24T21:18:20,Bug fixing / Maintenance,0,0,1,1,2.2,1,2187.0
3270,MAPREDUCE,,Improvement,Major,1,MAPREDUCE-5809,12703528,Enhance distcp to support preserving HDFS ACLs.,2014-03-25T17:50:53,2014-09-03T20:33:52,Feature / Improvement Implementation,0,0,1,1,2.2,1,2188.0
3271,MAPREDUCE,,Improvement,Major,1,MAPREDUCE-5812,12703913, Make job context available to OutputCommitter.isRecoverySupported(),2014-03-27T06:38:45,2014-09-03T20:33:51,Feature / Improvement Implementation,0,0,1,1,2.2,1,2189.0
3276,MAPREDUCE,,Bug,Major,1,MAPREDUCE-5821,12706674,IFile merge allocates new byte array for every value,2014-04-04T17:49:11,2014-09-09T20:13:58,Bug fixing / Maintenance,0,0,1,1,2.2,1,2190.0
3277,MAPREDUCE,,Bug,Major,1,MAPREDUCE-5822,12707045,FairScheduler does not preempt due to fairshare-starvation when fairshare is 1,2014-04-07T22:42:18,2014-04-11T21:53:24,Bug fixing / Maintenance,0,0,1,1,2.2,1,2191.0
3279,MAPREDUCE,,Improvement,Major,1,MAPREDUCE-5825,12707654,Provide diagnostics for reducers killed during ramp down,2014-04-10T07:33:35,2014-09-03T20:33:51,Feature / Improvement Implementation,0,0,1,1,2.2,1,2192.0
3281,MAPREDUCE,,Bug,Major,1,MAPREDUCE-5827,12707807,TestSpeculativeExecutionWithMRApp fails,2014-04-10T21:38:46,2014-09-04T01:12:23,Testing & Verification,0,0,1,1,2.2,1,2193.0
3282,MAPREDUCE,,Bug,Major,1,MAPREDUCE-5829,12707869,MRAppMaster misses writing queue-name/user-name to history when recovering from a previous commit,2014-04-11T03:58:40,2014-04-11T03:58:40,Bug fixing / Maintenance,0,0,1,1,2.2,1,2194.0
3285,MAPREDUCE,,Bug,Major,1,MAPREDUCE-5832,12708064,Few tests in TestJobClient fail on Windows,2014-04-12T01:05:56,2014-06-30T08:18:08,Testing & Verification,0,0,1,1,2.2,1,2195.0
3286,MAPREDUCE,,Bug,Major,1,MAPREDUCE-5834,12708280,TestGridMixClasses tests timesout on branch-2,2014-04-14T15:15:10,2016-05-12T18:24:11,Testing & Verification,0,0,1,1,2.2,1,2196.0
329,MAPREDUCE,,Bug,Major,1,MAPREDUCE-1040,12436583,"acls are not set to ""*"" when acls is enabled and acls are not defined",2009-09-25T10:38:13,2009-09-25T10:41:13,Bug fixing / Maintenance,0,0,1,1,2.2,1,2197.0
3290,MAPREDUCE,,Bug,Major,1,MAPREDUCE-5884,12708656,History server uses short user name when canceling tokens,2014-04-16T01:07:22,2014-09-03T20:33:52,Bug fixing / Maintenance,0,0,1,1,2.2,1,2198.0
3292,MAPREDUCE,,Bug,Major,1,MAPREDUCE-5841,12708982,uber job doesn't terminate on getting mapred job kill,2014-04-17T03:21:08,2014-06-30T08:18:10,Bug fixing / Maintenance,0,0,1,1,2.2,1,2199.0
3293,MAPREDUCE,,Bug,Major,1,MAPREDUCE-5844,12709096,Add a configurable delay to reducer-preemption,2014-04-17T17:10:33,2015-10-09T14:55:44,Bug fixing / Maintenance,0,0,1,1,2.2,1,2200.0
3294,MAPREDUCE,,Test,Major,1,MAPREDUCE-5843,12709118,TestMRKeyValueTextInputFormat failing on Windows,2014-04-17T18:55:48,2014-06-30T08:18:12,Testing & Verification,0,0,1,1,2.2,1,2201.0
3295,MAPREDUCE,,Bug,Major,1,MAPREDUCE-5846,12709153,Rumen doesn't understand JobQueueChangedEvent,2014-04-17T21:37:37,2015-03-10T04:30:47,Bug fixing / Maintenance,0,0,1,1,2.2,1,2202.0
3296,MAPREDUCE,,Sub-task,Major,1,MAPREDUCE-5848,12709157,MapReduce counts forcibly preempted containers as FAILED,2014-04-17T21:54:25,2014-09-22T21:17:34,Build & Release Engineering,0,0,1,1,2.2,1,2203.0
33,MAPREDUCE,,Bug,Major,1,MAPREDUCE-639,12423431,Update the TeraSort to reflect the new benchmark rules for '09,2009-04-22T02:24:54,2010-08-24T21:13:59,Bug fixing / Maintenance,0,0,1,1,2.2,1,2204.0
3300,MAPREDUCE,,Bug,Major,1,MAPREDUCE-5853,12709866,ChecksumFileSystem.getContentSummary() including contents for crc files ,2014-04-22T20:39:38,2014-04-22T20:58:15,Bug fixing / Maintenance,0,0,1,1,2.2,1,2205.0
3301,MAPREDUCE,,Bug,Major,1,MAPREDUCE-5855,12710163,Oozie jobs able to affect container classpath,2014-04-23T21:57:07,2014-04-23T22:01:08,Bug fixing / Maintenance,0,0,1,1,2.2,1,2206.0
3302,MAPREDUCE,,Bug,Major,1,MAPREDUCE-5856,12710169,Counter limits always use defaults even if JobClient is given a different Configuration,2014-04-23T22:18:38,2014-05-08T17:07:05,Bug fixing / Maintenance,0,0,1,1,2.2,1,2207.0
3303,MAPREDUCE,,Sub-task,Major,1,MAPREDUCE-5867,12710300,Possible NPE in KillAMPreemptionPolicy related to ProportionalCapacityPreemptionPolicy,2014-04-24T12:45:54,2016-05-12T18:23:58,Build & Release Engineering,0,0,1,1,2.2,1,2208.0
3304,MAPREDUCE,,Improvement,Major,1,MAPREDUCE-5859,12710560,org.apache.hadoop.mapreduce.lib.input.FileInputFormat.listStatus should not throw an exception if at least one of input path is not empty,2014-04-25T14:46:43,2014-04-25T14:46:43,Feature / Improvement Implementation,0,0,1,1,2.2,1,2209.0
3307,MAPREDUCE,,Bug,Major,1,MAPREDUCE-5863,12710751,Killing task attempts while speculation is enabled can cause the job to fail,2014-04-27T04:22:52,2014-04-28T02:01:33,Bug fixing / Maintenance,0,0,1,1,2.2,1,2210.0
3308,MAPREDUCE,,Bug,Major,1,MAPREDUCE-5864,12710865,"The part-r-00000 did not generate when I run a sample, wordcount with non-ascii path.",2014-04-28T08:05:47,2014-09-14T13:16:33,Bug fixing / Maintenance,0,0,1,1,2.2,1,2211.0
331,MAPREDUCE,,Improvement,Major,1,MAPREDUCE-1046,12436724,Remove mapred.{map|reduce}.child.ulimit and use mapred.job.{map|reduce}.memory.mb as the task's ulimit value,2009-09-28T02:47:46,2009-09-28T02:47:46,Performance Optimization,0,0,1,1,2.2,1,2212.0
3310,MAPREDUCE,,Bug,Major,1,MAPREDUCE-5868,12711195,TestPipeApplication causing nightly build to fail,2014-04-29T15:24:46,2015-03-10T04:30:32,Testing & Verification,0,0,1,1,2.2,1,2213.0
3311,MAPREDUCE,,Bug,Major,1,MAPREDUCE-5874,12711368,Creating MapReduce REST API section,2014-04-30T02:08:26,2014-08-15T05:48:00,Bug fixing / Maintenance,0,0,1,1,2.2,1,2214.0
3313,MAPREDUCE,,Bug,Major,1,MAPREDUCE-5873,12711783,Shuffle bandwidth computation includes time spent waiting for maps,2014-05-01T20:03:05,2014-12-01T03:09:00,Bug fixing / Maintenance,0,0,1,1,2.2,1,2215.0
3314,MAPREDUCE,,Bug,Major,1,MAPREDUCE-5875,12712162,"Make Counter limits consistent across JobClient, MRAppMaster, and YarnChild",2014-05-04T01:33:32,2019-10-25T20:26:14,Bug fixing / Maintenance,0,0,1,1,2.2,1,2216.0
3316,MAPREDUCE,,Bug,Major,1,MAPREDUCE-5878,12712436,some standard JDK APIs are not part of system classes defaults,2014-05-05T22:11:05,2014-12-01T03:07:56,Bug fixing / Maintenance,0,0,1,1,2.2,1,2217.0
3317,MAPREDUCE,,Bug,Major,1,MAPREDUCE-5879,12712539,Hive is broke after YARN-1553,2014-05-06T09:15:54,2014-05-06T09:25:45,Bug fixing / Maintenance,0,0,1,1,2.2,1,2218.0
3318,MAPREDUCE,,Bug,Major,1,MAPREDUCE-5885,12713310,build/test/test.mapred.spill causes release audit warnings,2014-05-09T13:48:59,2015-03-10T04:30:42,Testing & Verification,0,0,1,1,2.2,1,2219.0
332,MAPREDUCE,,Bug,Major,1,MAPREDUCE-1047,12436765,hadoop.pipes.command.port missing from environment when using bash 4,2009-09-28T16:56:48,2009-11-24T15:32:27,Bug fixing / Maintenance,0,0,1,1,2.2,1,2220.0
3320,MAPREDUCE,,Improvement,Major,1,MAPREDUCE-5887,12713546,Move split creation from submission client to MRAppMaster,2014-05-12T02:14:26,2014-05-14T09:39:38,Design & API Evolution,0,0,1,1,2.2,1,2221.0
3321,MAPREDUCE,,Bug,Major,1,MAPREDUCE-5888,12713772,Failed job leaves hung AM after it unregisters ,2014-05-12T22:40:06,2014-09-03T20:33:52,Bug fixing / Maintenance,0,0,1,1,2.2,1,2222.0
3323,MAPREDUCE,,New Feature,Major,1,MAPREDUCE-5890,12714395,Support for encrypting Intermediate data and spills in local filesystem,2014-05-15T04:05:29,2019-02-12T19:29:22,Feature / Improvement Implementation,0,0,1,1,2.2,1,2223.0
3324,MAPREDUCE,,Sub-task,Major,1,MAPREDUCE-5891,12714514,Improved shuffle error handling across NM restarts,2014-05-15T15:50:39,2015-04-02T13:49:13,Other,0,0,1,1,2.2,1,2224.0
3325,MAPREDUCE,,Improvement,Major,1,MAPREDUCE-5894,12714983,Make critical YARN properties first class citizens in the build.,2014-05-18T01:45:55,2014-05-18T01:59:44,Build & Release Engineering,0,0,1,1,2.2,1,2225.0
3328,MAPREDUCE,,Bug,Major,1,MAPREDUCE-5895,12715380,FileAlreadyExistsException was thrown : Temporary Index File can not be cleaned up because OutputStream doesn't close properly,2014-05-20T08:34:54,2016-05-12T18:24:24,Bug fixing / Maintenance,0,0,1,1,2.2,1,2226.0
3329,MAPREDUCE,,Improvement,Major,1,MAPREDUCE-5896,12715594,InputSplits should indicate which locations have the block cached in memory,2014-05-20T20:41:51,2014-08-15T05:47:57,Performance Optimization,0,0,1,1,2.2,1,2227.0
333,MAPREDUCE,,Improvement,Major,1,MAPREDUCE-1048,12436901,Show total slot usage in cluster summary on jobtracker webui,2009-09-30T09:12:30,2010-08-24T21:18:22,Documentation,0,0,1,1,2.2,1,2228.0
3330,MAPREDUCE,,Bug,Major,1,MAPREDUCE-5898,12715766,distcp to support preserving HDFS extended attributes(XAttrs),2014-05-21T14:32:22,2016-05-12T18:22:26,Bug fixing / Maintenance,0,0,1,1,2.2,1,2229.0
3331,MAPREDUCE,,New Feature,Major,1,MAPREDUCE-5901,12715838,Hadoop 2.4 Java execution issue: remotely submission jobs fail ,2014-05-21T19:31:45,2014-05-21T22:39:57,Feature / Improvement Implementation,0,0,1,1,2.2,1,2230.0
3332,MAPREDUCE,,Bug,Major,1,MAPREDUCE-5902,12716260,"JobHistoryServer (HistoryFileManager) needs more debug logs, fails to pick up jobs with % characters in the name.",2014-05-23T04:13:23,2014-05-29T13:21:40,Bug fixing / Maintenance,0,0,1,1,2.2,1,2231.0
3334,MAPREDUCE,,Bug,Major,1,MAPREDUCE-5908,12717255,java.lang.NoSuchMethodError: org.apache.commons.io.IOUtils.closeQuietly(Ljava/io/Closeable;)V,2014-05-29T11:11:15,2014-05-29T11:11:15,Bug fixing / Maintenance,0,0,1,1,2.2,1,2232.0
3335,MAPREDUCE,,Bug,Major,1,MAPREDUCE-5909,12717345,"JobStatus contains 0.0 values of mapProgress, reduceProgress, setupProgress, cleanupProgress",2014-05-29T19:44:12,2014-05-29T19:44:12,Bug fixing / Maintenance,0,0,1,1,2.2,1,2233.0
3336,MAPREDUCE,,Task,Major,1,MAPREDUCE-5910,12717515,MRAppMaster should handle Resync from RM instead of shutting down.,2014-05-30T12:42:42,2014-12-01T03:08:24,Project / General Task,0,0,1,1,2.2,1,2234.0
3338,MAPREDUCE,,Bug,Major,1,MAPREDUCE-5912,12718395,Task.calculateOutputSize does not handle Windows files after MAPREDUCE-5196,2014-06-04T15:37:03,2016-05-12T18:24:48,Bug fixing / Maintenance,0,0,1,1,2.2,1,2235.0
334,MAPREDUCE,,Test,Major,1,MAPREDUCE-1050,12437037,Introduce a mock object testing framework,2009-10-01T16:30:48,2010-08-24T21:18:23,Testing & Verification,0,0,1,1,2.2,1,2236.0
3340,MAPREDUCE,,Bug,Major,1,MAPREDUCE-5950,12719051,incorrect description in distcp2 document,2014-06-08T06:53:19,2014-12-01T03:08:23,Documentation,0,0,1,1,2.2,1,2237.0
3341,MAPREDUCE,,Bug,Major,1,MAPREDUCE-5918,12719071,LineRecordReader can return the same decompressor to CodecPool multiple times,2014-06-08T15:15:33,2015-10-30T18:16:10,Bug fixing / Maintenance,0,0,1,1,2.2,1,2238.0
3342,MAPREDUCE,,Bug,Major,1,MAPREDUCE-5919,12720122,Usage of aggregate framework always results in execution of base class ValueAggregatorBaseDescriptor.,2014-06-09T15:07:42,2014-06-09T15:07:42,Documentation,0,0,1,1,2.2,1,2239.0
3346,MAPREDUCE,,Bug,Major,1,MAPREDUCE-5924,12721035,Windows: Sort Job failed due to 'Invalid event: TA_COMMIT_PENDING at COMMIT_PENDING',2014-06-13T05:02:09,2014-08-15T05:47:59,Bug fixing / Maintenance,0,0,1,1,2.2,1,2240.0
3349,MAPREDUCE,,Bug,Major,1,MAPREDUCE-5928,12721414,Deadlock allocating containers for mappers and reducers,2014-06-16T13:41:16,2014-06-18T15:34:43,Bug fixing / Maintenance,0,0,1,1,2.2,1,2241.0
3351,MAPREDUCE,,Improvement,Major,1,MAPREDUCE-5932,12721845,Provide an option to use a dedicated reduce-side shuffle log,2014-06-18T06:22:00,2015-04-24T23:15:18,Feature / Improvement Implementation,0,0,1,1,2.2,1,2242.0
3352,MAPREDUCE,,Sub-task,Major,1,MAPREDUCE-5933,12722039,Enable MR AM to post history events to the timeline server,2014-06-18T08:26:46,2014-12-01T03:09:59,Design & API Evolution,0,0,1,1,2.2,1,2243.0
3353,MAPREDUCE,,Sub-task,Major,1,MAPREDUCE-5934,12722115,Make JHS source the timeline server for job history information,2014-06-18T08:49:02,2014-06-19T05:51:12,Design & API Evolution,0,0,1,1,2.2,1,2244.0
3354,MAPREDUCE,,Bug,Major,1,MAPREDUCE-5936,12722807,MultipleInputs incorrect output with copied Path,2014-06-20T15:58:06,2014-06-20T15:58:06,Bug fixing / Maintenance,0,0,1,1,2.2,1,2245.0
3355,MAPREDUCE,,Bug,Major,1,MAPREDUCE-5939,12723206,StartTime showing up as the epoch time in JHS UI after upgrade,2014-06-23T20:13:48,2014-09-03T20:33:53,Bug fixing / Maintenance,0,0,1,1,2.2,1,2246.0
3356,MAPREDUCE,,Improvement,Major,1,MAPREDUCE-5941,12723780,JobCounter's should be organized in groups  for map and reduce ,2014-06-25T23:52:33,2014-06-25T23:52:33,Feature / Improvement Implementation,0,0,1,1,2.2,1,2247.0
3360,MAPREDUCE,,Improvement,Major,1,MAPREDUCE-5946,12724020,Last spill of map task is not necessary for final merge,2014-06-27T00:44:54,2014-06-27T01:16:11,Feature / Improvement Implementation,0,0,1,1,2.2,1,2248.0
3361,MAPREDUCE,,Improvement,Major,1,MAPREDUCE-5947,12724031,Map phase merge can better utilize memory,2014-06-27T01:15:13,2014-06-27T01:16:37,Performance Optimization,0,0,1,1,2.2,1,2249.0
3362,MAPREDUCE,,Bug,Major,1,MAPREDUCE-5949,12724283,Tasktracker's java threads hunging,2014-06-28T09:02:53,2014-06-29T11:44:22,Bug fixing / Maintenance,0,0,1,1,2.2,1,2250.0
3364,MAPREDUCE,,Improvement,Major,1,MAPREDUCE-5953,12724779,DBInputFormat forces overly aggressive transaction level of SERIALIZABLE ,2014-07-01T17:37:35,2014-07-01T17:37:35,Feature / Improvement Implementation,0,0,1,1,2.2,1,2251.0
3366,MAPREDUCE,,Bug,Major,1,MAPREDUCE-5957,12724880,AM throws ClassNotFoundException with job classloader enabled if custom output format/committer is used,2014-07-02T05:08:06,2014-12-01T03:09:26,Bug fixing / Maintenance,0,0,1,1,2.2,1,2252.0
3368,MAPREDUCE,,Bug,Major,1,MAPREDUCE-5959,12725632,java.lang.ClassCastException during terasort,2014-07-06T15:45:35,2014-07-21T09:46:41,Bug fixing / Maintenance,0,0,1,1,2.2,1,2253.0
3369,MAPREDUCE,,Bug,Major,1,MAPREDUCE-5960,12725652,JobSubmitter's check whether job.jar is local is incorrect with no authority in job jar path.,2014-07-06T23:22:54,2014-12-15T23:06:08,Bug fixing / Maintenance,0,0,1,1,2.2,1,2254.0
3371,MAPREDUCE,,Sub-task,Major,1,MAPREDUCE-5963,12726235,ShuffleHandler DB schema should be versioned with compatible/incompatible changes,2014-07-09T02:58:38,2014-12-01T03:10:44,Build & Release Engineering,0,0,1,1,2.2,1,2255.0
3372,MAPREDUCE,,Bug,Major,1,MAPREDUCE-5966,12726716,MR1 FairScheduler use of custom weight adjuster is not thread safe for comparisons,2014-07-11T00:22:01,2014-07-26T19:58:59,Bug fixing / Maintenance,0,0,1,1,2.2,1,2256.0
3373,MAPREDUCE,,Bug,Major,1,MAPREDUCE-5968,12726870,Work directory is not deleted when downloadCacheObject throws IOException,2014-07-11T20:02:04,2014-08-05T06:35:08,Bug fixing / Maintenance,0,0,1,1,2.2,1,2257.0
3378,MAPREDUCE,,Sub-task,Major,1,MAPREDUCE-5974,12727961,Allow specifying multiple MapOutputCollectors with fallback,2014-07-17T16:15:26,2014-12-14T04:22:30,Build & Release Engineering,0,0,1,1,2.2,1,2258.0
338,MAPREDUCE,,Bug,Major,1,MAPREDUCE-1057,12437268,java tasks are not honouring the value of mapred.userlog.limit.kb,2009-10-05T10:06:25,2010-03-31T05:27:23,Bug fixing / Maintenance,0,0,1,1,2.2,1,2259.0
3382,MAPREDUCE,,Bug,Major,1,MAPREDUCE-5979,12728077,FairScheduler: zero weight can cause sort failures,2014-07-17T23:09:58,2014-07-22T23:04:47,Bug fixing / Maintenance,0,0,1,1,2.2,1,2260.0
3386,MAPREDUCE,,Improvement,Major,1,MAPREDUCE-5989,12728841,Add DeletionService in AM,2014-07-22T12:27:53,2014-11-21T09:09:53,Feature / Improvement Implementation,0,0,1,1,2.2,1,2261.0
3387,MAPREDUCE,,Sub-task,Major,1,MAPREDUCE-5991,12728956,native-task should not run unit tests if native profile is not enabled,2014-07-22T20:16:00,2014-09-13T14:05:17,Testing & Verification,0,0,1,1,2.2,1,2262.0
3388,MAPREDUCE,,Sub-task,Major,1,MAPREDUCE-5992,12728958,native-task test logs should not write to console,2014-07-22T20:17:22,2014-09-03T02:29:20,Testing & Verification,0,0,1,1,2.2,1,2263.0
339,MAPREDUCE,,Bug,Major,1,MAPREDUCE-1059,12437328,distcp can generate uneven map task assignments,2009-10-05T23:46:24,2010-01-05T15:58:40,Bug fixing / Maintenance,0,0,1,1,2.2,1,2264.0
