task_id,project_key,component_signature,main_issuetype,main_priority,issue_count,issue_keys,jira_ids,representative_summary,first_created,last_updated,Task_Tag,indegree,outdegree,is_root,is_leaf,duration_hours,topo_level,topo_order
969,MAPREDUCE,,Improvement,Major,1,MAPREDUCE-2202,12480881,Generalize CLITest structure and interfaces to facilitate upstream adoption (e.g. for web or system testing),2010-11-25T00:32:23,2011-11-15T00:49:23,Build & Release Engineering,0,0,1,1,2.2,1,3253.0
971,MAPREDUCE,,Bug,Major,1,MAPREDUCE-2205,12491608,FairScheduler should not re-schedule jobs that have just been preempted,2010-11-30T02:18:43,2010-12-16T19:51:52,Bug fixing / Maintenance,0,0,1,1,2.2,1,3254.0
972,MAPREDUCE,,Improvement,Major,1,MAPREDUCE-2207,12491698,Task-cleanup task should not be scheduled on the node that the task just failed,2010-11-30T21:35:19,2011-11-15T00:50:01,Code Refactoring & Cleanup,0,0,1,1,2.2,1,3255.0
973,MAPREDUCE,,Bug,Major,1,MAPREDUCE-2210,12492129,Preemption does not obey job priority,2010-12-06T06:31:49,2011-02-07T23:23:58,Bug fixing / Maintenance,0,0,1,1,2.2,1,3256.0
974,MAPREDUCE,,Bug,Major,1,MAPREDUCE-2211,12492584,java.lang.OutOfMemoryError occurred while running the high ram streaming job.,2010-12-07T06:56:55,2010-12-22T04:43:06,Bug fixing / Maintenance,0,0,1,1,2.2,1,3257.0
975,MAPREDUCE,,Improvement,Major,1,MAPREDUCE-2212,12492652,MapTask and ReduceTask should only compress/decompress the final map output file,2010-12-07T19:49:42,2011-11-15T00:49:07,Feature / Improvement Implementation,0,0,1,1,2.2,1,3258.0
977,MAPREDUCE,,Bug,Major,1,MAPREDUCE-2215,12492794,A more elegant FileSystem#listCorruptFileBlocks API (RAID changes),2010-12-09T02:34:26,2013-05-02T02:29:34,Bug fixing / Maintenance,0,0,1,1,2.2,1,3259.0
978,MAPREDUCE,,Bug,Major,1,MAPREDUCE-2216,12492877,speculation should normalize progress rates based on amount of input data,2010-12-09T20:07:02,2010-12-12T17:10:46,Bug fixing / Maintenance,0,0,1,1,2.2,1,3260.0
979,MAPREDUCE,,Improvement,Major,1,MAPREDUCE-2218,12493252,schedule additional tasks when killactions are being dispatched,2010-12-14T23:38:07,2010-12-22T14:14:34,Feature / Improvement Implementation,0,0,1,1,2.2,1,3261.0
980,MAPREDUCE,,Bug,Major,1,MAPREDUCE-2219,12493368,JT should not try to remove mapred.system.dir during startup,2010-12-15T22:11:29,2011-12-12T06:19:33,Bug fixing / Maintenance,0,0,1,1,2.2,1,3262.0
981,MAPREDUCE,,Bug,Major,1,MAPREDUCE-2222,12493558,Ivy resolve force mode should be turned off by default,2010-12-17T22:39:03,2011-12-12T06:19:24,Bug fixing / Maintenance,0,0,1,1,2.2,1,3263.0
985,MAPREDUCE,,Bug,Major,1,MAPREDUCE-2228,12493832,Remove java5 dependencies from build,2010-12-22T05:18:25,2011-02-12T14:30:42,Bug fixing / Maintenance,0,0,1,1,2.2,1,3264.0
986,MAPREDUCE,,Bug,Major,1,MAPREDUCE-2229,12493942,Initialize reader in Sort example,2010-12-23T03:20:43,2011-03-07T23:05:52,Bug fixing / Maintenance,0,0,1,1,2.2,1,3265.0
987,MAPREDUCE,,Bug,Major,1,MAPREDUCE-2232,12494061,Add missing methods to TestMapredGroupMappingServiceRefresh,2010-12-25T21:20:04,2011-04-07T15:40:46,Testing & Verification,0,0,1,1,2.2,1,3266.0
988,MAPREDUCE,,Bug,Major,1,MAPREDUCE-2233,12494089,LinuxTaskController throws NPE when task fails to start,2010-12-27T03:02:10,2011-01-05T20:58:19,Bug fixing / Maintenance,0,0,1,1,2.2,1,3267.0
989,MAPREDUCE,,Sub-task,Major,1,MAPREDUCE-2234,12494092,"If Localizer can't create task log directory, it should fail on the spot",2010-12-27T03:36:57,2011-12-12T06:20:01,Other,0,0,1,1,2.2,1,3268.0
99,MAPREDUCE,,Bug,Major,1,MAPREDUCE-662,12428880,distcp -update fails if source directory is empty (i.e. no files to copy) and target directory does not exists.,2009-06-25T17:58:36,2010-08-24T21:14:09,Bug fixing / Maintenance,0,0,1,1,2.2,1,3269.0
990,MAPREDUCE,,Bug,Major,1,MAPREDUCE-2235,12494125,"JobTracker ""over-synchronization"" makes it hang up in certain cases ",2010-12-27T15:25:31,2011-01-03T20:29:03,Bug fixing / Maintenance,0,0,1,1,2.2,1,3270.0
992,MAPREDUCE,,Improvement,Major,1,MAPREDUCE-2239,12494552,BlockPlacementPolicyRaid should call getBlockLocations only when necessary,2011-01-04T01:48:58,2011-11-15T00:49:36,Feature / Improvement Implementation,0,0,1,1,2.2,1,3271.0
995,MAPREDUCE,,Improvement,Major,1,MAPREDUCE-2248,12494816,DistributedRaidFileSystem should unraid only the corrupt block,2011-01-06T08:46:52,2011-11-15T00:49:14,Feature / Improvement Implementation,0,0,1,1,2.2,1,3272.0
997,MAPREDUCE,,Bug,Major,1,MAPREDUCE-2251,12495160,Remove mapreduce.job.userhistorylocation config,2011-01-10T19:34:12,2012-07-08T16:18:51,Bug fixing / Maintenance,0,0,1,1,2.2,1,3273.0
1082,MAPREDUCE,,Bug,Critical,1,MAPREDUCE-2395,12501714,TestBlockFixer timing out on trunk,2011-03-17T18:00:34,2011-11-15T00:49:31,Testing & Verification,0,0,1,1,2.6,1,3274.0
1123,MAPREDUCE,,Bug,Critical,1,MAPREDUCE-2457,12505371,job submission should inject group.name (on the JT side),2011-04-28T05:13:05,2011-12-12T06:19:41,Bug fixing / Maintenance,0,0,1,1,2.6,1,3275.0
1191,MAPREDUCE,,Bug,Critical,1,MAPREDUCE-2541,12508627,"Race Condition in IndexCache(readIndexFileToCache,removeMap) causes value of totalMemoryUsed corrupt, which may cause TaskTracker continue throw Exception",2011-05-28T17:34:53,2011-11-15T00:48:50,Bug fixing / Maintenance,0,0,1,1,2.6,1,3276.0
1250,MAPREDUCE,,Bug,Critical,1,MAPREDUCE-2646,12512932,MR-279: AM with same sized maps and reduces hangs in presence of failing maps,2011-07-06T05:40:42,2011-11-15T00:48:37,Bug fixing / Maintenance,0,0,1,1,2.6,1,3277.0
1286,MAPREDUCE,,Bug,Critical,1,MAPREDUCE-2693,12514292,NPE in AM causes it to lose containers which are never returned back to RM,2011-07-15T22:33:56,2011-11-15T00:48:30,Bug fixing / Maintenance,0,0,1,1,2.6,1,3278.0
1350,MAPREDUCE,,Bug,Critical,1,MAPREDUCE-2783,12518053,mr279 job history handling after killing application,2011-08-05T17:30:36,2012-10-30T23:06:10,Bug fixing / Maintenance,0,0,1,1,2.6,1,3279.0
1364,MAPREDUCE,,Improvement,Critical,1,MAPREDUCE-2802,12518500,[MR-279] Jobhistory filenames should have jobID to help in better parsing ,2011-08-10T18:58:03,2011-11-15T00:49:58,Feature / Improvement Implementation,0,0,1,1,2.6,1,3280.0
1422,MAPREDUCE,,Bug,Critical,1,MAPREDUCE-2913,12520756,TestMRJobs.testFailingMapper does not assert the correct thing.,2011-08-30T14:12:35,2015-03-16T17:57:17,Testing & Verification,0,0,1,1,2.6,1,3281.0
1442,MAPREDUCE,,Bug,Critical,1,MAPREDUCE-2937,12521533,Errors in Application failures are not shown in the client trace.,2011-09-07T03:52:19,2011-11-15T00:49:07,Bug fixing / Maintenance,0,1,1,0,2.6,1,3282.0
1446,MAPREDUCE,,Bug,Critical,1,MAPREDUCE-2942,12521570,TestNMAuditLogger.testNMAuditLoggerWithIP failing,2011-09-07T10:54:58,2015-03-10T04:31:45,Testing & Verification,0,0,1,1,2.6,1,3283.0
1448,MAPREDUCE,,Task,Critical,1,MAPREDUCE-2945,12521583,Hbase Batch Import Insertion Method,2011-09-07T12:48:34,2011-09-07T13:08:58,Project / General Task,0,0,1,1,2.6,1,3284.0
1457,MAPREDUCE,,Bug,Critical,1,MAPREDUCE-2954,12522256,Deadlock in NM with threads racing for ApplicationAttemptId,2011-09-08T13:28:48,2015-03-16T17:57:14,Bug fixing / Maintenance,0,0,1,1,2.6,1,3285.0
1462,MAPREDUCE,,Bug,Critical,1,MAPREDUCE-2963,12522350,TestMRJobs hangs waiting to connect to history server.,2011-09-09T00:14:10,2015-03-10T04:32:27,Testing & Verification,0,0,1,1,2.6,1,3286.0
1482,MAPREDUCE,,Sub-task,Critical,1,MAPREDUCE-2988,12522801,Reenable TestLinuxContainerExecutor reflecting the current NM code. ,2011-09-12T20:23:17,2015-03-16T17:57:14,Testing & Verification,0,1,1,0,2.6,1,3287.0
1491,MAPREDUCE,,Bug,Critical,1,MAPREDUCE-2998,12522915,Failing to contact Am/History for jobs: java.io.EOFException in DataInputStream,2011-09-13T15:57:21,2015-03-16T17:57:14,Bug fixing / Maintenance,0,0,1,1,2.6,1,3288.0
1492,MAPREDUCE,,Bug,Critical,1,MAPREDUCE-2999,12522924,hadoop.http.filter.initializers not working properly on yarn UI,2011-09-13T17:17:46,2013-05-02T02:29:44,Bug fixing / Maintenance,0,0,1,1,2.6,1,3289.0
1520,MAPREDUCE,,Bug,Critical,1,MAPREDUCE-3034,12523557,NM should act on a REBOOT command from RM,2011-09-19T13:57:52,2012-03-06T13:30:31,Bug fixing / Maintenance,0,0,1,1,2.6,1,3290.0
1521,MAPREDUCE,,Bug,Critical,1,MAPREDUCE-3035,12523570,MR V2 jobhistory does not contain rack information,2011-09-19T15:21:04,2011-11-15T00:49:21,Bug fixing / Maintenance,0,0,1,1,2.6,1,3291.0
1539,MAPREDUCE,,Bug,Critical,1,MAPREDUCE-3058,12523856,Sometimes task keeps on running while its Syslog says that it is shutdown,2011-09-21T12:53:39,2011-11-15T00:48:45,Bug fixing / Maintenance,0,0,1,1,2.6,1,3292.0
1553,MAPREDUCE,,Bug,Critical,1,MAPREDUCE-3087,12524569,CLASSPATH not the same after MAPREDUCE-2880,2011-09-25T17:00:07,2012-02-20T09:55:25,Bug fixing / Maintenance,0,0,1,1,2.6,1,3293.0
1573,MAPREDUCE,,Bug,Critical,1,MAPREDUCE-3116,12525084,RM and NM fail to start (webapps/cluster is missing),2011-09-28T17:10:30,2015-03-17T04:02:28,Bug fixing / Maintenance,0,0,1,1,2.6,1,3294.0
1581,MAPREDUCE,,Bug,Critical,1,MAPREDUCE-3125,12525248,app master web UI shows reduce task progress 100% even though reducers not complete and state running/scheduled,2011-09-29T22:29:32,2011-11-15T00:50:08,Bug fixing / Maintenance,0,0,1,1,2.6,1,3295.0
1592,MAPREDUCE,,Sub-task,Critical,1,MAPREDUCE-3144,12525828,Augment JobHistory to include information needed for serving aggregated logs.,2011-10-05T13:42:03,2011-11-15T00:49:05,Other,0,1,1,0,2.6,1,3296.0
1594,MAPREDUCE,,Sub-task,Critical,1,MAPREDUCE-3146,12525831,Add a MR specific command line to dump logs for a given TaskAttemptID,2011-10-05T13:52:00,2011-11-15T00:48:34,Build & Release Engineering,0,1,1,0,2.6,1,3297.0
1616,MAPREDUCE,,Bug,Critical,1,MAPREDUCE-3177,12526940,mapreduce tar layout does not conform new layout,2011-10-12T21:59:19,2015-03-10T04:31:44,Bug fixing / Maintenance,0,0,1,1,2.6,1,3298.0
1623,MAPREDUCE,,Bug,Critical,1,MAPREDUCE-3185,12527133,RM Web UI does not sort the columns in some cases.,2011-10-14T01:09:05,2011-11-15T00:50:18,Bug fixing / Maintenance,0,0,1,1,2.6,1,3299.0
1662,MAPREDUCE,,Task,Critical,1,MAPREDUCE-3251,12528503,Network ACLs can prevent some clients to talk to MR ApplicationMaster,2011-10-24T15:40:35,2012-03-05T02:49:45,Design & API Evolution,0,0,1,1,2.6,1,3300.0
1663,MAPREDUCE,,Bug,Critical,1,MAPREDUCE-3252,12528555,MR2: Map tasks rewrite data once even if output fits in sort buffer,2011-10-24T20:50:54,2011-11-15T00:48:24,Bug fixing / Maintenance,0,0,1,1,2.6,1,3301.0
1671,MAPREDUCE,,Bug,Critical,1,MAPREDUCE-3262,12528722,A few events are not handled by the NodeManager in failure scenarios,2011-10-25T17:42:25,2011-11-15T00:49:18,Bug fixing / Maintenance,0,0,1,1,2.6,1,3302.0
1677,MAPREDUCE,,Bug,Critical,1,MAPREDUCE-3271,12528787,Lost nodes list and count not updated,2011-10-25T23:31:13,2012-01-12T21:42:09,Bug fixing / Maintenance,0,0,1,1,2.6,1,3303.0
1678,MAPREDUCE,,Bug,Critical,1,MAPREDUCE-3272,12528790,Lost NMs fail to rejoin,2011-10-25T23:47:18,2011-12-08T00:39:48,Bug fixing / Maintenance,0,0,1,1,2.6,1,3304.0
1680,MAPREDUCE,,Improvement,Critical,1,MAPREDUCE-3275,12528970,Add docs for WebAppProxy,2011-10-26T21:50:31,2015-03-10T04:32:05,Documentation,0,0,1,1,2.6,1,3305.0
1681,MAPREDUCE,,Bug,Critical,1,MAPREDUCE-3277,12528996,TestSeveral is failing in 0.23,2011-10-26T23:55:16,2011-11-04T07:53:48,Testing & Verification,0,0,1,1,2.6,1,3306.0
1692,MAPREDUCE,,Bug,Critical,1,MAPREDUCE-3292,12529180,In secure mode job submission fails with Provider org.apache.hadoop.mapreduce.security.token.JobTokenIndentifier$Renewer not found.,2011-10-28T02:00:36,2011-11-15T00:50:13,Bug fixing / Maintenance,0,0,1,1,2.6,1,3307.0
17,MAPREDUCE,,Bug,Critical,1,MAPREDUCE-77,12415715,JobConf is deprecated but Job does not support a constructor for Configuration,2009-02-26T23:37:13,2009-08-11T06:13:05,Bug fixing / Maintenance,0,0,1,1,2.6,1,3308.0
1702,MAPREDUCE,,Bug,Critical,1,MAPREDUCE-3308,12529320,MR builds failing due to download failure,2011-10-28T21:53:38,2012-02-08T02:53:22,Bug fixing / Maintenance,0,0,1,1,2.6,1,3309.0
1711,MAPREDUCE,,Bug,Critical,1,MAPREDUCE-3324,12529696,"Not All HttpServer tools links (stacks,logs,config,metrics) are accessible through all UI servers",2011-11-01T16:52:36,2012-03-05T02:49:55,Bug fixing / Maintenance,0,0,1,1,2.6,1,3310.0
1713,MAPREDUCE,,Bug,Critical,1,MAPREDUCE-3326,12529706,RM web UI scheduler link not as useful as should be,2011-11-01T17:45:30,2015-03-10T04:31:46,Bug fixing / Maintenance,0,0,1,1,2.6,1,3311.0
1714,MAPREDUCE,,Bug,Critical,1,MAPREDUCE-3327,12529733,RM web ui scheduler link doesn't show correct max value for queues,2011-11-01T20:20:25,2012-03-05T02:48:48,Bug fixing / Maintenance,0,0,1,1,2.6,1,3312.0
1715,MAPREDUCE,,Bug,Critical,1,MAPREDUCE-3328,12529742,mapred queue -list output inconsistent and missing child queues,2011-11-01T20:35:58,2012-03-05T02:49:19,Bug fixing / Maintenance,0,0,1,1,2.6,1,3313.0
1722,MAPREDUCE,,Bug,Critical,1,MAPREDUCE-3336,12529953,com.google.inject.internal.Preconditions not public api - shouldn't be using it,2011-11-02T21:35:43,2012-03-05T02:48:53,Bug fixing / Maintenance,0,1,1,0,2.6,1,3314.0
1727,MAPREDUCE,,Bug,Critical,1,MAPREDUCE-3342,12530120,JobHistoryServer doesn't show job queue,2011-11-03T21:52:04,2012-03-05T02:49:45,Bug fixing / Maintenance,0,2,1,0,2.6,1,3315.0
1741,MAPREDUCE,,Improvement,Critical,1,MAPREDUCE-3360,12530414,Provide information about lost nodes in the UI.,2011-11-05T09:28:09,2013-09-10T13:34:44,Feature / Improvement Implementation,0,0,1,1,2.6,1,3316.0
1742,MAPREDUCE,,Bug,Critical,1,MAPREDUCE-3363,12530536,"The ""totalnodes""  and ""memorytotal"" fields show wrong information if the nodes are going down and coming up early(before 10min) ",2011-11-07T07:03:56,2015-03-10T04:32:38,Bug fixing / Maintenance,0,0,1,1,2.6,1,3317.0
1758,MAPREDUCE,,Bug,Critical,1,MAPREDUCE-3382,12530815,Network ACLs can prevent AMs to ping the Job-end notification URL,2011-11-09T03:43:06,2012-03-05T02:49:49,Bug fixing / Maintenance,0,0,1,1,2.6,1,3318.0
1760,MAPREDUCE,,Bug,Critical,1,MAPREDUCE-3387,12530887,A tracking URL of N/A before the app master is launched breaks oozie,2011-11-09T15:21:20,2015-03-10T04:32:11,Bug fixing / Maintenance,0,0,1,1,2.6,1,3319.0
1761,MAPREDUCE,,Bug,Critical,1,MAPREDUCE-3388,12530894,Streaming task with special char gets wrong output ,2011-11-09T16:24:19,2015-03-10T04:32:13,Bug fixing / Maintenance,0,0,1,1,2.6,1,3320.0
1762,MAPREDUCE,,Bug,Critical,1,MAPREDUCE-3389,12530933,MRApps loads the 'mrapp-generated-classpath' file with classpath from the build machine,2011-11-09T22:30:52,2015-03-10T04:32:02,Bug fixing / Maintenance,0,0,1,1,2.6,1,3321.0
1776,MAPREDUCE,,Bug,Critical,1,MAPREDUCE-3405,12531535,MAPREDUCE-3015 broke compilation of contrib scheduler tests,2011-11-15T21:39:30,2012-10-17T18:27:23,Testing & Verification,0,0,1,1,2.6,1,3322.0
1817,MAPREDUCE,,Bug,Critical,1,MAPREDUCE-3466,12532536,hadoop-mapreduce-tools*.jar does not seem to be updated on maven repo,2011-11-23T21:35:13,2011-11-23T22:08:02,Bug fixing / Maintenance,0,0,1,1,2.6,1,3323.0
1818,MAPREDUCE,,Bug,Critical,1,MAPREDUCE-3467,12532542,Mavenizing har,2011-11-23T22:32:25,2011-12-22T19:00:59,Bug fixing / Maintenance,0,0,1,1,2.6,1,3324.0
1830,MAPREDUCE,,Bug,Critical,1,MAPREDUCE-3487,12533330,jobhistory web ui task counters no longer links to singletakecounter page,2011-11-30T19:01:48,2012-03-05T02:49:40,Bug fixing / Maintenance,0,0,1,1,2.6,1,3325.0
1853,MAPREDUCE,,Bug,Critical,1,MAPREDUCE-3529,12534584,TokenCache does not cache viewfs credentials correctly,2011-12-10T03:46:36,2012-03-05T02:49:44,Bug fixing / Maintenance,0,0,1,1,2.6,1,3326.0
1856,MAPREDUCE,,Bug,Critical,1,MAPREDUCE-3532,12534743,"When 0 is provided as port number in yarn.nodemanager.webapp.address, NMs webserver component picks up random port, NM keeps on Reporting 0 port to RM",2011-12-12T05:59:18,2012-03-05T02:49:27,Bug fixing / Maintenance,0,0,1,1,2.6,1,3327.0
1862,MAPREDUCE,,Bug,Critical,1,MAPREDUCE-3543,12535055,Mavenize Gridmix.,2011-12-13T23:13:35,2013-05-02T02:29:53,Bug fixing / Maintenance,0,0,1,1,2.6,1,3328.0
1865,MAPREDUCE,,Bug,Critical,1,MAPREDUCE-3546,12535078,slf4j versions mismatched between yarn and hdfs,2011-12-14T02:15:43,2015-03-10T04:32:09,Bug fixing / Maintenance,0,0,1,1,2.6,1,3329.0
1866,MAPREDUCE,,Sub-task,Critical,1,MAPREDUCE-3547,12535079,finish unit tests for web services for RM and NM,2011-12-14T02:41:19,2013-05-02T02:29:48,Testing & Verification,0,0,1,1,2.6,1,3330.0
1876,MAPREDUCE,,Sub-task,Critical,1,MAPREDUCE-3566,12535361,MR AM slows down due to repeatedly constructing ContainerLaunchContext,2011-12-15T19:57:00,2012-03-05T02:48:57,Performance Optimization,0,0,1,1,2.6,1,3331.0
1878,MAPREDUCE,,Sub-task,Critical,1,MAPREDUCE-3568,12535378,Optimize Job's progress calculations in MR AM,2011-12-15T22:09:54,2012-03-05T02:49:41,Performance Optimization,0,0,1,1,2.6,1,3332.0
1881,MAPREDUCE,,Sub-task,Critical,1,MAPREDUCE-3572,12535398,MR AM's dispatcher is blocked by heartbeats to ResourceManager,2011-12-16T01:08:02,2012-03-05T02:49:17,Other,0,0,1,1,2.6,1,3333.0
1887,MAPREDUCE,,Bug,Critical,1,MAPREDUCE-3583,12535850,ProcfsBasedProcessTree#constructProcessInfo() may throw NumberFormatException,2011-12-20T15:07:55,2014-01-09T17:22:24,Bug fixing / Maintenance,0,0,1,1,2.6,1,3334.0
1907,MAPREDUCE,,Sub-task,Critical,1,MAPREDUCE-3613,12537085,web service calls header contains 2 content types,2012-01-03T18:11:01,2012-10-11T17:48:50,Other,0,0,1,1,2.6,1,3335.0
1917,MAPREDUCE,,Bug,Critical,1,MAPREDUCE-3625,12537400,CapacityScheduler web-ui display of queue's used capacity is broken,2012-01-05T19:53:53,2012-03-05T02:49:12,Bug fixing / Maintenance,0,0,1,1,2.6,1,3336.0
1920,MAPREDUCE,,Task,Critical,1,MAPREDUCE-3630,12537460,NullPointerException running teragen,2012-01-06T02:28:37,2012-03-05T02:48:40,Project / General Task,0,0,1,1,2.6,1,3337.0
1924,MAPREDUCE,,Bug,Critical,1,MAPREDUCE-3637,12537592,Health checker interval does not appear to work - according to web ui,2012-01-06T21:15:40,2012-01-06T22:29:51,Bug fixing / Maintenance,0,0,1,1,2.6,1,3338.0
1936,MAPREDUCE,,Bug,Critical,1,MAPREDUCE-3654,12538004,"MiniMRYarnCluster should set MASTER_ADDRESS to ""local""",2012-01-11T01:10:56,2012-01-23T23:07:42,Bug fixing / Maintenance,0,0,1,1,2.6,1,3339.0
1959,MAPREDUCE,,Bug,Critical,1,MAPREDUCE-3686,12538836,history server web ui - job counter values for map/reduce not shown properly,2012-01-18T16:55:48,2012-02-27T05:41:23,Bug fixing / Maintenance,0,0,1,1,2.6,1,3340.0
1963,MAPREDUCE,,Bug,Critical,1,MAPREDUCE-3691,12538878,webservices add support to compress response,2012-01-18T20:53:52,2013-05-02T02:29:48,Bug fixing / Maintenance,0,0,1,1,2.6,1,3341.0
1965,MAPREDUCE,,Bug,Critical,1,MAPREDUCE-3694,12538926,JobClient.getJob(JobID) broken in 0.23 for LocalJobRunner?,2012-01-19T06:04:00,2012-01-24T06:37:31,Bug fixing / Maintenance,0,0,1,1,2.6,1,3342.0
1971,MAPREDUCE,,Bug,Critical,1,MAPREDUCE-3702,12539154,internal server error trying access application master via proxy with filter enabled,2012-01-20T15:38:54,2012-03-05T02:49:52,Bug fixing / Maintenance,0,0,1,1,2.6,1,3343.0
1972,MAPREDUCE,,Bug,Critical,1,MAPREDUCE-3703,12539169,ResourceManager should provide node lists in JMX output,2012-01-20T16:46:24,2012-03-05T02:49:12,Bug fixing / Maintenance,0,0,1,1,2.6,1,3344.0
1973,MAPREDUCE,,Bug,Critical,1,MAPREDUCE-3706,12539256,HTTP Circular redirect error on the job attempts page,2012-01-21T04:01:30,2016-03-04T05:51:08,Bug fixing / Maintenance,0,0,1,1,2.6,1,3345.0
1992,MAPREDUCE,,Bug,Critical,1,MAPREDUCE-3727,12539815,jobtoken location property in jobconf refers to wrong jobtoken file,2012-01-25T19:33:35,2013-05-15T05:16:12,Bug fixing / Maintenance,0,0,1,1,2.6,1,3346.0
1993,MAPREDUCE,,Bug,Critical,1,MAPREDUCE-3728,12539819,ShuffleHandler can't access results when configured in a secure mode,2012-01-25T19:48:13,2013-07-30T00:12:00,Bug fixing / Maintenance,0,0,1,1,2.6,1,3347.0
1994,MAPREDUCE,,Bug,Critical,1,MAPREDUCE-3729,12539846,"Commit build failing TestJobClientGetJob, TestMRWithDistributedCache, TestLocalModeWithNewApis",2012-01-25T23:56:34,2012-04-05T14:20:08,Testing & Verification,0,0,1,1,2.6,1,3348.0
2001,MAPREDUCE,,Bug,Critical,1,MAPREDUCE-3737,12539951,The Web Application Proxy's is not documented very well,2012-01-26T18:50:32,2012-03-05T02:49:27,Documentation,0,0,1,1,2.6,1,3349.0
2002,MAPREDUCE,,Bug,Critical,1,MAPREDUCE-3738,12539965,NM can hang during shutdown if AppLogAggregatorImpl thread dies unexpectedly,2012-01-26T20:57:34,2015-03-10T04:31:58,Bug fixing / Maintenance,0,0,1,1,2.6,1,3350.0
2005,MAPREDUCE,,Bug,Critical,1,MAPREDUCE-3746,12540214,Nodemanagers are not automatically shut down after decommissioning,2012-01-27T23:20:03,2012-02-19T05:12:30,Bug fixing / Maintenance,0,0,1,1,2.6,1,3351.0
2016,MAPREDUCE,,Bug,Critical,1,MAPREDUCE-3762,12540441,Resource Manager fails to come up with default capacity scheduler configs.,2012-01-30T21:40:08,2012-03-05T02:49:29,Bug fixing / Maintenance,0,0,1,1,2.6,1,3352.0
2017,MAPREDUCE,,Bug,Critical,1,MAPREDUCE-3764,12540456,AllocatedGB etc metrics incorrect if min-allocation-mb isn't a multiple of 1GB,2012-01-30T23:21:35,2012-03-05T02:48:44,Bug fixing / Maintenance,0,0,1,1,2.6,1,3353.0
202,MAPREDUCE,,Bug,Critical,1,MAPREDUCE-821,12432056,JobClient.runJob leaks file descriptors,2009-08-03T15:42:29,2009-08-03T20:00:27,Bug fixing / Maintenance,0,0,1,1,2.6,1,3354.0
2022,MAPREDUCE,,Bug,Critical,1,MAPREDUCE-3770,12540503,[Rumen] Zombie.getJobConf() results into NPE,2012-01-31T06:54:50,2015-03-10T04:31:43,Bug fixing / Maintenance,0,1,1,0,2.6,1,3355.0
2030,MAPREDUCE,,Bug,Critical,1,MAPREDUCE-3789,12540903,CapacityTaskScheduler may perform unnecessary reservations in heterogenous tracker environments,2012-02-02T10:07:47,2012-10-17T18:27:24,Bug fixing / Maintenance,0,0,1,1,2.6,1,3356.0
2033,MAPREDUCE,,Bug,Critical,1,MAPREDUCE-3792,12541004,job -list displays only the jobs submitted by a particular user,2012-02-02T21:42:51,2012-03-04T13:57:53,Bug fixing / Maintenance,0,0,1,1,2.6,1,3357.0
2046,MAPREDUCE,,Task,Critical,1,MAPREDUCE-3811,12541340,Make the Client-AM IPC retry count configurable,2012-02-05T21:42:42,2013-11-08T18:16:09,Design & API Evolution,0,0,1,1,2.6,1,3358.0
2050,MAPREDUCE,,Sub-task,Critical,1,MAPREDUCE-3815,12541369,Data Locality suffers if the AM asks for containers using IPs instead of hostnames,2012-02-06T04:20:21,2012-03-05T02:49:21,Other,0,1,1,0,2.6,1,3359.0
2053,MAPREDUCE,,Bug,Critical,1,MAPREDUCE-3821,12541500,NPE while running Shuffle benchmark,2012-02-06T20:49:54,2012-02-06T20:53:05,Bug fixing / Maintenance,0,0,1,1,2.6,1,3360.0
2054,MAPREDUCE,,Bug,Critical,1,MAPREDUCE-3822,12541503,TestJobCounters is failing intermittently on trunk and 0.23.,2012-02-06T21:07:45,2012-03-05T02:49:32,Testing & Verification,0,0,1,1,2.6,1,3361.0
2056,MAPREDUCE,,Bug,Critical,1,MAPREDUCE-3824,12541523,Distributed caches are not removed properly,2012-02-06T22:49:48,2012-04-05T18:42:08,Bug fixing / Maintenance,0,0,1,1,2.6,1,3362.0
2064,MAPREDUCE,,Bug,Critical,1,MAPREDUCE-3834,12541683,"If multiple hosts for a split belong to the same rack, the rack is added multiple times in the AM request table",2012-02-07T19:47:59,2012-03-05T02:49:06,Bug fixing / Maintenance,0,0,1,1,2.6,1,3363.0
2067,MAPREDUCE,,Improvement,Critical,1,MAPREDUCE-3842,12541893,stop webpages from automatic refreshing,2012-02-08T22:54:02,2012-10-11T17:48:45,Feature / Improvement Implementation,0,0,1,1,2.6,1,3364.0
2068,MAPREDUCE,,Bug,Critical,1,MAPREDUCE-3843,12542027,Job summary log file found missing on the RM host,2012-02-09T20:45:49,2012-03-05T02:49:47,Bug fixing / Maintenance,0,0,1,1,2.6,1,3365.0
2071,MAPREDUCE,,Sub-task,Critical,1,MAPREDUCE-3846,12542047,Restarted+Recovered AM hangs in some corner cases,2012-02-09T22:51:29,2012-03-05T02:49:24,Other,0,1,1,0,2.6,1,3366.0
2078,MAPREDUCE,,Bug,Critical,1,MAPREDUCE-3856,12542417,Instances of RunningJob class givs incorrect job tracking urls when mutiple jobs are submitted from same client jvm.,2012-02-13T16:33:26,2012-03-05T02:49:33,Bug fixing / Maintenance,0,0,1,1,2.6,1,3367.0
2080,MAPREDUCE,,Bug,Critical,1,MAPREDUCE-3858,12542468,Task attempt failure during commit results in task never completing,2012-02-14T01:21:24,2013-05-17T21:02:20,Bug fixing / Maintenance,0,0,1,1,2.6,1,3368.0
2083,MAPREDUCE,,Bug,Critical,1,MAPREDUCE-3863,12542724,0.22 branch mvn deploy is not publishing hadoop-streaming JAR,2012-02-15T18:19:09,2012-05-03T14:07:27,Bug fixing / Maintenance,0,0,1,1,2.6,1,3369.0
2093,MAPREDUCE,,Bug,Critical,1,MAPREDUCE-3878,12543109,Null user on filtered jobhistory job page,2012-02-17T22:15:41,2012-02-24T13:57:44,Bug fixing / Maintenance,0,0,1,1,2.6,1,3370.0
2097,MAPREDUCE,,Bug,Critical,1,MAPREDUCE-3884,12543424,PWD should be first in the classpath of MR tasks,2012-02-21T02:19:40,2012-02-23T13:55:32,Bug fixing / Maintenance,0,0,1,1,2.6,1,3371.0
2099,MAPREDUCE,,Bug,Critical,1,MAPREDUCE-3889,12543572,"job client tries to use /tasklog interface, but that doesn't exist anymore",2012-02-21T21:37:22,2016-05-12T18:23:13,Bug fixing / Maintenance,0,0,1,1,2.6,1,3372.0
2101,MAPREDUCE,,Bug,Critical,1,MAPREDUCE-3893,12543685,allow capacity scheduler configs maximum-applications and maximum-am-resource-percent configurable on a per queue basis,2012-02-22T14:16:11,2012-11-12T20:32:58,Bug fixing / Maintenance,0,0,1,1,2.6,1,3373.0
2104,MAPREDUCE,,Bug,Critical,1,MAPREDUCE-3897,12543744,capacity scheduler - maxActiveApplicationsPerUser calculation can be wrong,2012-02-22T21:41:09,2012-03-05T13:25:43,Bug fixing / Maintenance,0,0,1,1,2.6,1,3374.0
2107,MAPREDUCE,,Bug,Critical,1,MAPREDUCE-3903,12543865,no admin override to view jobs on mr app master and job history server,2012-02-23T17:28:29,2012-03-01T13:58:07,Bug fixing / Maintenance,0,0,1,1,2.6,1,3375.0
2116,MAPREDUCE,,Bug,Critical,1,MAPREDUCE-3913,12544020,RM application webpage is unresponsive after 2000 jobs,2012-02-24T17:28:55,2012-02-28T14:17:35,Bug fixing / Maintenance,0,0,1,1,2.6,1,3376.0
2118,MAPREDUCE,,Bug,Critical,1,MAPREDUCE-3916,12544027,various issues with running yarn proxyserver,2012-02-24T18:22:30,2016-05-12T18:22:52,Bug fixing / Maintenance,0,0,1,1,2.6,1,3377.0
