task_id,project_key,component_signature,main_issuetype,main_priority,issue_count,issue_keys,jira_ids,representative_summary,first_created,last_updated,Task_Tag,indegree,outdegree,is_root,is_leaf,duration_hours,topo_level,topo_order
1367,MAPREDUCE,,Sub-task,Major,1,MAPREDUCE-2807,12518567,MR-279: AM restart does not work after RM refactor,2011-08-11T08:54:47,2011-11-15T00:50:02,Code Refactoring & Cleanup,0,1,1,0,2.2,1,1011.0
137,MAPREDUCE,,Bug,Major,1,MAPREDUCE-720,12429672,Task logs should have right access-control,2009-07-07T05:06:35,2009-08-10T10:55:31,Bug fixing / Maintenance,0,0,1,1,2.2,1,1012.0
1371,MAPREDUCE,,Bug,Major,1,MAPREDUCE-2837,12518658,MR-279: Bug fixes ported from y-merge,2011-08-11T23:47:09,2011-08-15T18:01:19,Bug fixing / Maintenance,0,0,1,1,2.2,1,1013.0
1375,MAPREDUCE,,Bug,Major,1,MAPREDUCE-2843,12518913,[MR-279] Node entries on the RM UI are not sortable,2011-08-15T19:24:40,2015-03-16T17:57:11,Bug fixing / Maintenance,0,0,1,1,2.2,1,1014.0
1379,MAPREDUCE,,Improvement,Major,1,MAPREDUCE-2849,12519180,Add javadoc and site documentation for MRv2,2011-08-17T20:13:39,2011-11-15T00:49:27,Documentation,0,0,1,1,2.2,1,1015.0
138,MAPREDUCE,,Bug,Major,1,MAPREDUCE-722,12429695,More slots are getting reserved for HiRAM job tasks then required,2009-07-07T08:27:08,2010-08-24T21:14:27,Bug fixing / Maintenance,0,0,1,1,2.2,1,1016.0
1380,MAPREDUCE,,Sub-task,Major,1,MAPREDUCE-2850,12519199,Add test for TaskTracker disk failure handling (MR-2413),2011-08-17T22:37:05,2012-10-17T18:27:26,Testing & Verification,0,0,1,1,2.2,1,1017.0
1381,MAPREDUCE,,Bug,Major,1,MAPREDUCE-2852,12519203,Jira for YDH bug 2854624 ,2011-08-17T22:56:05,2011-10-19T00:26:10,Bug fixing / Maintenance,0,0,1,1,2.2,1,1018.0
1382,MAPREDUCE,,Bug,Major,1,MAPREDUCE-2854,12519307,update INSTALL with config necessary run mapred on yarn,2011-08-18T15:45:34,2011-11-15T00:48:48,Bug fixing / Maintenance,0,0,1,1,2.2,1,1019.0
1383,MAPREDUCE,,Task,Major,1,MAPREDUCE-2856,12519328,wire hadoop-mapreduce build to trunk build in Maven POM,2011-08-18T18:08:32,2013-05-02T02:29:43,Build & Release Engineering,0,0,1,1,2.2,1,1020.0
1386,MAPREDUCE,,Bug,Major,1,MAPREDUCE-2860,12519376,Fix log4j logging in the maven test cases.,2011-08-19T05:45:49,2011-11-15T00:48:44,Testing & Verification,0,0,1,1,2.2,1,1021.0
1387,MAPREDUCE,,Bug,Major,1,MAPREDUCE-2861,12519381,Modify version_control.html to reflect new path to mapreduce trunk,2011-08-19T07:32:30,2011-09-26T14:08:47,Bug fixing / Maintenance,0,0,1,1,2.2,1,1022.0
1388,MAPREDUCE,,Bug,Major,1,MAPREDUCE-2862,12519430,"Infinite loop in CombineFileInputFormat#getMoreSplits(), with missing blocks",2011-08-19T16:55:45,2011-12-23T17:37:50,Bug fixing / Maintenance,0,0,1,1,2.2,1,1023.0
1390,MAPREDUCE,,Bug,Major,1,MAPREDUCE-2866,12519697,"""Ignoring 'duplicate' heartbeat from tracker_x:localhost/127.0.0.1:35419'; resending the previous 'lost' response"" message is coming continuously for some time",2011-08-22T15:06:37,2011-08-24T13:30:47,Bug fixing / Maintenance,0,0,1,1,2.2,1,1024.0
1391,MAPREDUCE,,Bug,Major,1,MAPREDUCE-2867,12519708,Remove Unused TestApplicaitonCleanup in resourcemanager/applicationsmanager.,2011-08-22T16:48:23,2011-11-15T00:48:07,Testing & Verification,0,0,1,1,2.2,1,1025.0
1392,MAPREDUCE,,Sub-task,Major,1,MAPREDUCE-2869,12519734,DelegationTokenRenewal should handle abstract delegation tokens,2011-08-22T20:40:41,2011-10-19T00:30:19,Other,0,0,1,1,2.2,1,1026.0
1393,MAPREDUCE,,Test,Major,1,MAPREDUCE-2871,12519748,Docs updates for MR2,2011-08-22T23:26:37,2011-11-15T00:49:02,Documentation,0,0,1,1,2.2,1,1027.0
1394,MAPREDUCE,,Bug,Major,1,MAPREDUCE-2874,12519877,ApplicationId printed in 2 different formats and has 2 different toString routines that are used,2011-08-23T20:46:35,2011-11-15T00:48:22,Bug fixing / Maintenance,0,0,1,1,2.2,1,1028.0
1395,MAPREDUCE,,Bug,Major,1,MAPREDUCE-2875,12519932,NM does not communicate Container crash to RM,2011-08-24T08:45:15,2011-11-15T00:49:29,Bug fixing / Maintenance,0,0,1,1,2.2,1,1029.0
1398,MAPREDUCE,,Bug,Major,1,MAPREDUCE-2879,12520138,Change mrv2 version to be 0.23.0-SNAPSHOT,2011-08-25T18:32:21,2012-01-10T04:44:04,Bug fixing / Maintenance,0,0,1,1,2.2,1,1030.0
1400,MAPREDUCE,,Bug,Major,1,MAPREDUCE-2881,12520170,"mapreduce ant compilation fails ""java.lang.IllegalStateException: impossible to get artifacts""",2011-08-25T21:58:15,2011-11-15T00:50:08,Bug fixing / Maintenance,0,0,1,1,2.2,1,1031.0
1403,MAPREDUCE,,Improvement,Major,1,MAPREDUCE-2887,12520312,MR changes to match HADOOP-7524 (multiple RPC protocols),2011-08-26T21:47:22,2013-05-02T02:29:43,Feature / Improvement Implementation,0,0,1,1,2.2,1,1032.0
1408,MAPREDUCE,,Sub-task,Major,1,MAPREDUCE-2895,12520475,Merge AllocateResponse and AMResponse,2011-08-28T11:01:23,2011-11-15T00:48:47,Other,0,0,1,1,2.2,1,1033.0
1409,MAPREDUCE,,Sub-task,Major,1,MAPREDUCE-2896,12520477,Remove all apis other than getters and setters in all org/apache/hadoop/yarn/api/records/*,2011-08-28T11:20:18,2011-11-15T00:48:15,Design & API Evolution,0,0,1,1,2.2,1,1034.0
141,MAPREDUCE,,Bug,Major,1,MAPREDUCE-730,12429771,allow relative paths to be created inside archives.,2009-07-08T00:06:43,2010-08-24T21:14:28,Bug fixing / Maintenance,0,0,1,1,2.2,1,1035.0
1410,MAPREDUCE,,Sub-task,Major,1,MAPREDUCE-2899,12520505,Replace major parts of ApplicationSubmissionContext with a ContainerLaunchContext,2011-08-29T01:38:31,2011-11-15T00:49:18,Other,0,0,1,1,2.2,1,1036.0
1411,MAPREDUCE,,Sub-task,Major,1,MAPREDUCE-2900,12520512,"Replace ContainerId, Resource in ContainerLaunchContext with Container",2011-08-29T03:39:17,2011-11-15T00:48:54,Other,0,0,1,1,2.2,1,1037.0
1412,MAPREDUCE,,Bug,Major,1,MAPREDUCE-2901,12520530,Build should fail sanely if protoc isn't on PATH,2011-08-29T07:28:39,2011-09-06T21:17:13,Bug fixing / Maintenance,0,0,1,1,2.2,1,1038.0
1413,MAPREDUCE,,Bug,Major,1,MAPREDUCE-2902,12520531,Merge DevelopingOnTrunkAfter279Merge wiki page into HowToContribute,2011-08-29T07:34:52,2011-08-29T07:34:52,Bug fixing / Maintenance,0,0,1,1,2.2,1,1039.0
1414,MAPREDUCE,,Bug,Major,1,MAPREDUCE-2904,12520552,HDFS jars added incorrectly to yarn classpath,2011-08-29T11:40:47,2011-11-15T00:49:41,Bug fixing / Maintenance,0,0,1,1,2.2,1,1040.0
1415,MAPREDUCE,,Bug,Major,1,MAPREDUCE-2905,12520604,CapBasedLoadManager incorrectly allows assignment when assignMultiple is true (was: assignmultiple per job),2011-08-29T17:20:13,2012-10-17T18:27:24,Bug fixing / Maintenance,0,0,1,1,2.2,1,1041.0
1416,MAPREDUCE,,Bug,Major,1,MAPREDUCE-2906,12520618,FindBugs OutOfMemoryError,2011-08-29T18:45:37,2011-08-29T19:02:29,Bug fixing / Maintenance,0,0,1,1,2.2,1,1042.0
1417,MAPREDUCE,,Bug,Major,1,MAPREDUCE-2907,12520636,ResourceManager logs filled with [INFO] debug messages from org.apache.hadoop.yarn.server.resourcemanager.scheduler.capacity.ParentQueue,2011-08-29T21:06:17,2011-11-15T00:48:40,Bug fixing / Maintenance,0,0,1,1,2.2,1,1043.0
1419,MAPREDUCE,,Sub-task,Major,1,MAPREDUCE-2909,12520675,Docs for remaining records in yarn-api,2011-08-30T01:33:07,2011-11-15T00:49:43,Documentation,0,0,1,1,2.2,1,1044.0
142,MAPREDUCE,,Improvement,Major,1,MAPREDUCE-731,12429779,Factor out the timer code in jobtracker and add a callback interface,2009-07-08T05:28:46,2009-07-08T17:29:21,Design & API Evolution,0,0,1,1,2.2,1,1045.0
1420,MAPREDUCE,,Improvement,Major,1,MAPREDUCE-2918,12520703,Provide programmatic access to use job log ,2011-08-30T07:53:37,2011-10-04T21:56:25,Feature / Improvement Implementation,0,0,1,1,2.2,1,1046.0
1421,MAPREDUCE,,Bug,Major,1,MAPREDUCE-2912,12520711,Trunk build failing due to testcase failures from many builds,2011-08-30T09:31:14,2011-09-14T15:57:27,Testing & Verification,0,0,1,1,2.2,1,1047.0
1423,MAPREDUCE,,Bug,Major,1,MAPREDUCE-2915,12520863,LinuxTaskController does not work when JniBasedUnixGroupsNetgroupMapping or JniBasedUnixGroupsMapping is enabled,2011-08-31T00:45:05,2011-10-25T12:32:51,Bug fixing / Maintenance,0,0,1,1,2.2,1,1048.0
1424,MAPREDUCE,,Bug,Major,1,MAPREDUCE-2916,12520872,Ivy build for MRv1 fails with bad organization for common daemon.,2011-08-31T05:33:46,2011-11-15T00:48:32,Bug fixing / Maintenance,0,0,1,1,2.2,1,1049.0
1425,MAPREDUCE,,Bug,Major,1,MAPREDUCE-2917,12520880,Corner case in container reservations,2011-08-31T06:44:32,2011-11-15T00:49:33,Bug fixing / Maintenance,0,0,1,1,2.2,1,1050.0
1427,MAPREDUCE,,Sub-task,Major,1,MAPREDUCE-2920,12521000,Local log dir links in the JT web UI are broken  ,2011-09-01T00:46:41,2012-08-22T01:20:17,Other,0,0,1,1,2.2,1,1051.0
1428,MAPREDUCE,,Sub-task,Major,1,MAPREDUCE-2921,12521002,TaskTracker won't start with failed local directory,2011-09-01T01:02:21,2011-11-11T22:39:31,Other,0,0,1,1,2.2,1,1052.0
143,MAPREDUCE,,Bug,Major,1,MAPREDUCE-735,12429780,ArrayIndexOutOfBoundsException is thrown by KeyFieldBasedPartitioner,2009-07-08T05:43:19,2009-07-22T14:48:30,Bug fixing / Maintenance,0,1,1,0,2.2,1,1053.0
1431,MAPREDUCE,,Sub-task,Major,1,MAPREDUCE-2924,12521141,TaskTracker number of failed disks to tolerate should be configurable,2011-09-02T03:31:10,2011-11-05T01:42:58,Other,0,0,1,1,2.2,1,1054.0
1432,MAPREDUCE,,Bug,Major,1,MAPREDUCE-2925,12521175,job -status <JOB_ID> is giving continuously info message for completed jobs on the console,2011-09-02T12:08:47,2015-03-16T17:57:13,Bug fixing / Maintenance,0,0,1,1,2.2,1,1055.0
1433,MAPREDUCE,,Bug,Major,1,MAPREDUCE-2926,12521206,500 Error in ResourceManager UI,2011-09-02T16:32:57,2015-03-16T17:57:17,Bug fixing / Maintenance,0,0,1,1,2.2,1,1056.0
1434,MAPREDUCE,,Bug,Major,1,MAPREDUCE-2927,12521227,CompletedJob.isUber throws a Yarn exception which makes the JobHistory UI unusable.,2011-09-02T20:16:12,2015-03-16T17:57:15,Bug fixing / Maintenance,0,0,1,1,2.2,1,1057.0
1435,MAPREDUCE,,Sub-task,Major,1,MAPREDUCE-2928,12521248,MR-2413 improvements,2011-09-02T23:45:23,2011-10-19T00:26:10,Other,0,0,1,1,2.2,1,1058.0
1436,MAPREDUCE,,Bug,Major,1,MAPREDUCE-2929,12521253,Move task-controller from bin to libexec,2011-09-03T00:41:09,2011-09-06T19:45:45,Bug fixing / Maintenance,0,0,1,1,2.2,1,1059.0
1437,MAPREDUCE,,Improvement,Major,1,MAPREDUCE-2930,12521305,Generate state graph from the State Machine Definition,2011-09-04T08:24:06,2011-11-15T00:48:53,Feature / Improvement Implementation,0,0,1,1,2.2,1,1060.0
1440,MAPREDUCE,,Improvement,Major,1,MAPREDUCE-2934,12521404,MR portion of HADOOP-7607 - Simplify the RPC proxy cleanup process,2011-09-06T01:39:44,2015-03-10T04:31:40,Code Refactoring & Cleanup,0,0,1,1,2.2,1,1061.0
1441,MAPREDUCE,,Bug,Major,1,MAPREDUCE-2936,12521428,Contrib Raid compilation broken after HDFS-1620,2011-09-06T09:01:30,2015-03-16T17:52:40,Bug fixing / Maintenance,0,0,1,1,2.2,1,1062.0
1444,MAPREDUCE,,Task,Major,1,MAPREDUCE-2939,12521538,Ant setup on hadoop7 jenkins host,2011-09-07T05:56:23,2011-12-12T06:20:04,Build & Release Engineering,0,1,1,0,2.2,1,1063.0
1449,MAPREDUCE,,Bug,Major,1,MAPREDUCE-2946,12521615,TaskTrackers fail at startup,2011-09-07T16:19:38,2011-10-19T00:30:19,Bug fixing / Maintenance,0,0,1,1,2.2,1,1064.0
145,MAPREDUCE,,Bug,Major,1,MAPREDUCE-733,12429802,"When running ant test TestTrackerBlacklistAcrossJobs, losing task tracker heartbeat exception occurs. ",2009-07-08T12:08:44,2010-08-24T21:14:29,Testing & Verification,0,0,1,1,2.2,1,1065.0
1450,MAPREDUCE,,Bug,Major,1,MAPREDUCE-2947,12521628,Sort fails on YARN+MR with lots of task failures,2011-09-07T17:23:18,2011-11-15T00:48:13,Bug fixing / Maintenance,0,0,1,1,2.2,1,1066.0
1451,MAPREDUCE,,Bug,Major,1,MAPREDUCE-2948,12521648,"Hadoop streaming test failure, post MR-2767",2011-09-07T19:43:29,2015-03-16T17:49:13,Testing & Verification,0,0,1,1,2.2,1,1067.0
1452,MAPREDUCE,,Bug,Major,1,MAPREDUCE-2949,12522238,NodeManager in a inconsistent state if a service startup fails.,2011-09-08T10:41:02,2015-03-10T04:32:07,Bug fixing / Maintenance,0,0,1,1,2.2,1,1068.0
1454,MAPREDUCE,,Bug,Major,1,MAPREDUCE-2951,12522241,Problem while building hadoop trunk on Windows 7,2011-09-08T11:02:36,2015-03-10T04:32:31,Bug fixing / Maintenance,0,0,1,1,2.2,1,1069.0
1456,MAPREDUCE,,Bug,Major,1,MAPREDUCE-2953,12522246,"JobClient fails due to a race in RM, removes staged files and in turn crashes MR AM",2011-09-08T12:02:15,2011-11-15T00:48:59,Bug fixing / Maintenance,0,0,1,1,2.2,1,1070.0
1458,MAPREDUCE,,Bug,Major,1,MAPREDUCE-2956,12522305,CompositeService should try to stop all services even if one fails,2011-09-08T19:01:24,2011-11-15T00:48:24,Bug fixing / Maintenance,0,0,1,1,2.2,1,1071.0
1459,MAPREDUCE,,Sub-task,Major,1,MAPREDUCE-2957,12522326,The TT should not re-init if it has no good local dirs,2011-09-08T21:02:59,2012-10-17T18:27:27,Other,0,0,1,1,2.2,1,1072.0
146,MAPREDUCE,,Bug,Major,1,MAPREDUCE-734,12429815,java.util.ConcurrentModificationException observed in unreserving slots for HiRam Jobs,2009-07-08T15:00:05,2010-08-24T21:14:31,Bug fixing / Maintenance,0,0,1,1,2.2,1,1073.0
1464,MAPREDUCE,,Improvement,Major,1,MAPREDUCE-2966,12522388,Add ShutDown hooks for MRV2 processes,2011-09-09T08:40:16,2015-03-16T17:57:16,Feature / Improvement Implementation,0,0,1,1,2.2,1,1074.0
1465,MAPREDUCE,,Bug,Major,1,MAPREDUCE-2968,12522403,ContainerID record should get rid of ApplicationId field ,2011-09-09T10:05:33,2011-11-15T00:49:29,Bug fixing / Maintenance,0,0,1,1,2.2,1,1075.0
1466,MAPREDUCE,,Bug,Major,1,MAPREDUCE-2970,12522425,"Null Pointer Exception while submitting a Job, If mapreduce.framework.name property is not set.",2011-09-09T13:38:41,2015-03-16T17:57:15,Bug fixing / Maintenance,0,0,1,1,2.2,1,1076.0
147,MAPREDUCE,,New Feature,Major,1,MAPREDUCE-740,12429851,Provide summary information per job once a job is finished.,2009-07-08T20:36:12,2010-08-24T21:14:32,Feature / Improvement Implementation,0,0,1,1,2.2,1,1077.0
1473,MAPREDUCE,,Bug,Major,1,MAPREDUCE-2978,12522470,hudson findbugs not reporting properly,2011-09-09T19:57:09,2016-05-12T18:23:56,Bug fixing / Maintenance,0,0,1,1,2.2,1,1078.0
1474,MAPREDUCE,,Bug,Major,1,MAPREDUCE-2979,12522482,Remove ClientProtocolProvider configuration under mapreduce-client-core,2011-09-09T22:08:16,2015-03-16T17:57:17,Bug fixing / Maintenance,0,0,1,1,2.2,1,1079.0
1475,MAPREDUCE,,Improvement,Major,1,MAPREDUCE-2981,12522665,Backport trunk fairscheduler to 0.20-security branch,2011-09-11T00:42:19,2011-10-19T17:13:18,Feature / Improvement Implementation,0,0,1,1,2.2,1,1080.0
1476,MAPREDUCE,,Bug,Major,1,MAPREDUCE-2982,12522750,App/Tasks progress is showing as 0% in UI even if successfully completed,2011-09-12T15:05:18,2015-03-10T04:32:15,Bug fixing / Maintenance,0,0,1,1,2.2,1,1081.0
1477,MAPREDUCE,,Bug,Major,1,MAPREDUCE-2983,12522751,All tasks are failing due to invalid shuffle port number,2011-09-12T15:13:43,2015-03-10T04:32:15,Bug fixing / Maintenance,0,0,1,1,2.2,1,1082.0
1479,MAPREDUCE,,Bug,Major,1,MAPREDUCE-2985,12522776,findbugs error in ResourceLocalizationService.handle(LocalizationEvent),2011-09-12T18:24:07,2015-03-16T17:57:16,Bug fixing / Maintenance,0,0,1,1,2.2,1,1083.0
1481,MAPREDUCE,,Bug,Major,1,MAPREDUCE-2987,12522796,RM UI display logged in user as null,2011-09-12T20:12:22,2011-11-15T00:49:01,Bug fixing / Maintenance,0,0,1,1,2.2,1,1084.0
1485,MAPREDUCE,,Bug,Major,1,MAPREDUCE-2991,12522823,queueinfo.jsp fails to show queue status if any Capacity scheduler queue name has dash/hiphen in it.,2011-09-12T23:21:37,2015-03-16T17:49:13,Bug fixing / Maintenance,0,0,1,1,2.2,1,1085.0
1487,MAPREDUCE,,Bug,Major,1,MAPREDUCE-2994,12522859,Parse Error is coming for App ID when we click application link on the RM UI,2011-09-13T08:21:18,2015-03-16T17:57:12,Bug fixing / Maintenance,0,0,1,1,2.2,1,1086.0
1488,MAPREDUCE,,Bug,Major,1,MAPREDUCE-2995,12522871,MR AM crashes when a container-launch hangs on a faulty NM,2011-09-13T09:49:51,2011-11-15T00:50:00,Bug fixing / Maintenance,0,0,1,1,2.2,1,1087.0
1490,MAPREDUCE,,Bug,Major,1,MAPREDUCE-2997,12522880,MR task fails before launch itself with an NPE in ContainerLauncher,2011-09-13T10:38:28,2011-11-15T00:48:37,Bug fixing / Maintenance,0,0,1,1,2.2,1,1088.0
1493,MAPREDUCE,,Bug,Major,1,MAPREDUCE-3000,12522925,Move /mapred to /user/mapred for Hadoop 0.20.205,2011-09-13T17:27:34,2011-10-19T00:30:19,Bug fixing / Maintenance,0,0,1,1,2.2,1,1089.0
1495,MAPREDUCE,,Bug,Major,1,MAPREDUCE-3003,12522963,Publish MR JARs to Maven snapshot repository,2011-09-13T21:47:32,2015-03-16T17:57:12,Bug fixing / Maintenance,0,1,1,0,2.2,1,1090.0
1497,MAPREDUCE,,Bug,Major,1,MAPREDUCE-3005,12522994,MR app hangs because of a NPE in ResourceManager,2011-09-14T04:29:08,2011-11-15T00:49:30,Bug fixing / Maintenance,0,0,1,1,2.2,1,1091.0
1498,MAPREDUCE,,Bug,Major,1,MAPREDUCE-3006,12523029,MapReduce AM exits prematurely before completely writing and closing the JobHistory file,2011-09-14T11:08:42,2011-11-15T00:50:10,Bug fixing / Maintenance,0,0,1,1,2.2,1,1092.0
15,MAPREDUCE,,Bug,Major,1,MAPREDUCE-542,12415140,FairScheduler.getJobs(queue) should return the jobs in the order of scheduling.,2009-02-19T14:13:21,2009-06-20T08:01:43,Bug fixing / Maintenance,0,0,1,1,2.2,1,1093.0
150,MAPREDUCE,,Bug,Major,1,MAPREDUCE-743,12429889,Progress of map phase in map task is not updated properly,2009-07-09T02:37:54,2010-08-24T21:14:33,Bug fixing / Maintenance,0,0,1,1,2.2,1,1094.0
1500,MAPREDUCE,,Sub-task,Major,1,MAPREDUCE-3008,12523049,[Gridmix] Improve cumulative CPU usage emulation for short running tasks,2011-09-14T13:08:49,2015-03-10T04:31:50,Documentation,0,0,1,1,2.2,1,1095.0
1502,MAPREDUCE,,Sub-task,Major,1,MAPREDUCE-3011,12523147,TT should remove bad local dirs from conf to prevent constant disk checking,2011-09-15T04:55:51,2012-05-29T06:32:50,Other,0,0,1,1,2.2,1,1096.0
1504,MAPREDUCE,,Improvement,Major,1,MAPREDUCE-3014,12523206,Rename and invert logic of '-cbuild' profile to 'native' and off by default,2011-09-15T15:24:46,2015-03-16T17:57:18,Build & Release Engineering,0,0,1,1,2.2,1,1097.0
1508,MAPREDUCE,,Bug,Major,1,MAPREDUCE-3019,12523284,"Can't find the symbol ""YARN_MR_PREFIX"" in MRConstants.java ",2011-09-16T03:28:40,2015-03-10T04:32:24,Bug fixing / Maintenance,0,0,1,1,2.2,1,1098.0
1509,MAPREDUCE,,Bug,Major,1,MAPREDUCE-3021,12523341,"all yarn webapps use same base name of ""yarn/""",2011-09-16T14:42:07,2013-07-17T22:56:47,Bug fixing / Maintenance,0,0,1,1,2.2,1,1099.0
151,MAPREDUCE,,Sub-task,Major,1,MAPREDUCE-744,12429923,Support in DistributedCache to share cache files with other users after HADOOP-4493,2009-07-09T09:49:47,2010-08-24T21:14:33,Other,0,0,1,1,2.2,1,1100.0
1510,MAPREDUCE,,Bug,Major,1,MAPREDUCE-3023,12523353,Queue state is not being translated properly (is always assumed to be running),2011-09-16T16:18:45,2011-11-15T00:50:16,Bug fixing / Maintenance,0,0,1,1,2.2,1,1101.0
1512,MAPREDUCE,,Bug,Major,1,MAPREDUCE-3026,12523404,"When user adds hierarchical queues to the cluster, mapred queue -list returns NULL Pointer Exception",2011-09-16T23:24:26,2011-11-23T05:39:27,Bug fixing / Maintenance,0,0,1,1,2.2,1,1102.0
1513,MAPREDUCE,,Bug,Major,1,MAPREDUCE-3027,12523413,MR-279: Completed container exit state needs to be enhanced to differentiate between container aborts/failures and actual application process exit codes,2011-09-17T01:37:37,2015-09-28T21:10:34,Bug fixing / Maintenance,0,0,1,1,2.2,1,1103.0
1515,MAPREDUCE,,Bug,Major,1,MAPREDUCE-3029,12523423,Eclipse Plugin not work on Eclipse Helios,2011-09-17T11:17:47,2011-11-16T05:17:45,Bug fixing / Maintenance,0,0,1,1,2.2,1,1104.0
1523,MAPREDUCE,,Improvement,Major,1,MAPREDUCE-3037,12523585,Add a consistent method for getting the job configuration's XML within the AppMaster and the JobHistory,2011-09-19T17:21:05,2015-09-28T21:10:30,Feature / Improvement Implementation,0,0,1,1,2.2,1,1105.0
1525,MAPREDUCE,,Bug,Major,1,MAPREDUCE-3039,12523605,Make mapreduce use same version of avro as HBase,2011-09-19T19:29:05,2011-12-12T06:19:25,Bug fixing / Maintenance,0,0,1,1,2.2,1,1106.0
1526,MAPREDUCE,,Bug,Major,1,MAPREDUCE-3040,12523608,"TestMRJobs, TestMRJobsWithHistoryService, TestMROldApiJobs fail",2011-09-19T20:06:26,2011-11-15T00:48:34,Testing & Verification,0,0,1,1,2.2,1,1107.0
153,MAPREDUCE,,Improvement,Major,1,MAPREDUCE-750,12430119,Extensible ConnManager factory API,2009-07-11T00:12:52,2010-07-02T06:31:48,Design & API Evolution,0,0,1,1,2.2,1,1108.0
1531,MAPREDUCE,,Bug,Major,1,MAPREDUCE-3048,12523665,"Fix test-patch to run tests via ""mvn clean install test""",2011-09-20T07:47:04,2011-11-15T00:49:18,Testing & Verification,0,0,1,1,2.2,1,1109.0
1533,MAPREDUCE,,Bug,Major,1,MAPREDUCE-3052,12523772,"Maintain consistency in naming appIDs, jobIDs and attemptIDs",2011-09-20T18:54:23,2011-09-26T04:19:22,Bug fixing / Maintenance,0,0,1,1,2.2,1,1110.0
1534,MAPREDUCE,,Bug,Major,1,MAPREDUCE-3053,12523791,YARN Protobuf RPC Failures in RM,2011-09-20T22:32:42,2011-11-15T00:49:33,Bug fixing / Maintenance,0,0,1,1,2.2,1,1111.0
154,MAPREDUCE,,New Feature,Major,1,MAPREDUCE-751,12430157,Rumen: a tool to extract job characterization data from job tracker logs,2009-07-12T04:04:24,2011-11-24T14:34:42,Feature / Improvement Implementation,0,2,1,0,2.2,1,1112.0
1545,MAPREDUCE,,Bug,Major,1,MAPREDUCE-3071,12524297,app master configuration web UI link under the Job menu opens up application menu,2011-09-22T15:17:28,2011-11-15T00:48:34,Bug fixing / Maintenance,0,0,1,1,2.2,1,1113.0
1546,MAPREDUCE,,Bug,Major,1,MAPREDUCE-3072,12524305,NodeManager doesn't recognize kill -9 of AM container,2011-09-22T16:39:16,2011-09-22T16:45:36,Bug fixing / Maintenance,0,0,1,1,2.2,1,1114.0
1548,MAPREDUCE,,Improvement,Major,1,MAPREDUCE-3077,12524364,"re-enable faulty TaskTracker storage without restarting TT, when appropriate",2011-09-23T01:17:39,2011-09-23T06:56:30,Feature / Improvement Implementation,0,0,1,1,2.2,1,1115.0
1550,MAPREDUCE,,Bug,Major,1,MAPREDUCE-3081,12524475,Change the name format for hadoop core and vaidya jar to be hadoop-{core/vaidya}-{version}.jar in vaidya.sh,2011-09-23T21:09:25,2011-10-19T00:26:05,Bug fixing / Maintenance,0,0,1,1,2.2,1,1116.0
1552,MAPREDUCE,,Bug,Major,1,MAPREDUCE-3085,12524498,Fix / remove failing tests from MrV1,2011-09-24T01:30:14,2015-03-10T04:32:22,Testing & Verification,0,0,1,1,2.2,1,1117.0
1554,MAPREDUCE,,Bug,Major,1,MAPREDUCE-3088,12524587,Clover 2.4.3 breaks build for 0.22 branch,2011-09-26T00:16:47,2011-12-12T06:19:10,Bug fixing / Maintenance,0,0,1,1,2.2,1,1118.0
1555,MAPREDUCE,,Improvement,Major,1,MAPREDUCE-3090,12524603,"Change MR AM to use ApplicationAttemptId rather than <applicationId, startCount> everywhere",2011-09-26T07:11:31,2011-11-15T00:48:53,Feature / Improvement Implementation,0,0,1,1,2.2,1,1119.0
1557,MAPREDUCE,,Bug,Major,1,MAPREDUCE-3095,12524730,fairscheduler ivy including wrong version for hdfs,2011-09-26T20:24:18,2011-11-15T00:48:36,Bug fixing / Maintenance,0,0,1,1,2.2,1,1120.0
1558,MAPREDUCE,,Task,Major,1,MAPREDUCE-3096,12524735,Add a good way to control the number of map/reduce tasks per node,2011-09-26T20:38:35,2011-09-27T07:59:29,Project / General Task,0,0,1,1,2.2,1,1121.0
156,MAPREDUCE,,Improvement,Major,1,MAPREDUCE-755,12430222,Improve TestMRKeyFieldBasedComparator to test encoded byte array,2009-07-13T17:07:55,2009-07-21T05:14:11,Testing & Verification,0,0,1,1,2.2,1,1122.0
1560,MAPREDUCE,,Bug,Major,1,MAPREDUCE-3100,12524793,distcp with an hftp destination url fails if the destination directory does not exist,2011-09-27T04:42:44,2011-09-27T05:34:56,Bug fixing / Maintenance,0,0,1,1,2.2,1,1123.0
1561,MAPREDUCE,,Sub-task,Major,1,MAPREDUCE-3102,12524797,NodeManager should fail fast with wrong configuration or permissions for LinuxContainerExecutor,2011-09-27T05:27:13,2012-03-05T02:49:37,Other,0,0,1,1,2.2,1,1124.0
1564,MAPREDUCE,,Sub-task,Major,1,MAPREDUCE-3105,12524801,NM<->RM shared secrets should be rolled every so often. ,2011-09-27T06:30:28,2012-03-08T22:16:24,Other,0,0,1,1,2.2,1,1125.0
1568,MAPREDUCE,,Bug,Major,1,MAPREDUCE-3109,12524852,NPE exception in the TestClass org.apache.hadoop.yarn.server.resourcemanager.Application,2011-09-27T12:53:57,2011-11-15T00:48:41,Testing & Verification,0,0,1,1,2.2,1,1126.0
1569,MAPREDUCE,,Bug,Major,1,MAPREDUCE-3110,12524856,TestRPC.testUnknownCall() is failing,2011-09-27T13:15:44,2011-11-15T00:50:04,Testing & Verification,0,0,1,1,2.2,1,1127.0
157,MAPREDUCE,,Bug,Major,1,MAPREDUCE-757,12430317,JobConf will not be deleted from the logs folder if job retires from finalizeJob(),2009-07-14T04:42:17,2011-11-11T06:26:27,Bug fixing / Maintenance,0,0,1,1,2.2,1,1128.0
1570,MAPREDUCE,,Bug,Major,1,MAPREDUCE-3112,12525012,Calling hadoop cli inside mapreduce job leads to errors,2011-09-28T05:42:18,2011-10-19T00:26:09,Bug fixing / Maintenance,0,0,1,1,2.2,1,1129.0
1575,MAPREDUCE,,New Feature,Major,1,MAPREDUCE-3118,12525140,Backport Gridmix and Rumen features from trunk to Hadoop 0.20 security branch,2011-09-29T05:51:07,2012-10-17T18:27:25,Feature / Improvement Implementation,0,0,1,1,2.2,1,1130.0
1578,MAPREDUCE,,Bug,Major,1,MAPREDUCE-3122,12525215,-libjars with streaming does not create symlink in the cwd of task,2011-09-29T17:05:49,2011-09-30T10:48:41,Bug fixing / Maintenance,0,0,1,1,2.2,1,1131.0
158,MAPREDUCE,,Bug,Major,1,MAPREDUCE-760,12430353,TestNodeRefresh might not work as expected,2009-07-14T10:53:10,2010-08-24T21:14:38,Testing & Verification,0,0,1,1,2.2,1,1132.0
1584,MAPREDUCE,,Improvement,Major,1,MAPREDUCE-3133,12525359,Running a set of methods in a Single Test Class,2011-09-30T19:45:11,2011-11-15T00:50:01,Testing & Verification,0,0,1,1,2.2,1,1133.0
1589,MAPREDUCE,,Bug,Major,1,MAPREDUCE-3139,12525614,SlivePartitioner generates negative partitions,2011-10-04T01:41:19,2012-02-08T02:49:08,Bug fixing / Maintenance,0,0,1,1,2.2,1,1134.0
1591,MAPREDUCE,,Bug,Major,1,MAPREDUCE-3143,12525806,Complete aggregation of user-logs spit out by containers onto DFS,2011-10-05T12:30:43,2013-09-01T23:28:38,Bug fixing / Maintenance,0,0,1,1,2.2,1,1135.0
1593,MAPREDUCE,,Sub-task,Major,1,MAPREDUCE-3145,12525830,Fix NM UI to serve logs from DFS once application finishes,2011-10-05T13:43:41,2011-11-15T00:48:53,Bug fixing / Maintenance,0,0,1,1,2.2,1,1136.0
1595,MAPREDUCE,,Improvement,Major,1,MAPREDUCE-3147,12525933,Handle leaf queues with the same name properly,2011-10-05T18:20:06,2012-03-05T02:49:10,Feature / Improvement Implementation,0,0,1,1,2.2,1,1137.0
